,text,ID,Titel,Autor,Strophen,Verse,Anthologie,Jahr,Hrsg
351,"Ich vergaß das Liebeslied...Und der Wald geht schwer im Brausenhier will meine Sehnsucht hausen —ich vergaß mein dunkles Lied!Tief in die lebendige Nacht!Tiefer! Aller Tag ist draußen!Atem! Atem! Dieses Brausen!Und mein Herz ist voll und lacht!Tiefer! Wie die Erde riecht!Und die Wipfel wuchten nieder!Dankend zittern meine Glieder,dankend, daß die Erde riecht!Hier ist meine Sehnsucht rein,und ich muß die Welten liebenund die Wolken, die da stieben!Und dies alles, es ist mein!Ich vergaß das Liebeslied...und vergaß — vergaß das Leben.Sturm in diesem Sturm verbeben!Atem! Meine Seele flieht! —***Tausend Lichter blitzen durch die Nacht.Die Geschehnisse folgen ihrem Laufdurch die Nächte, selbst blitzend und schwarz wie die Nacht.Ein bleiches Weib singt eine traurige Ballade.Unendlich — wo? wo? — der unbarmherzige Himmel,mitleidlos die wandernden, kalten Sterne,die ihrer Geschicke Lauf verfolgen.Ein bleiches Weib singt eine traurige Ballade.Die Nacht, und die Sterne, und die wilden Lichter! —Fernes Geheul! —über schwarzfahlen Giebeln ein Rauchgespenstisch wogt und verschwindet zur tiefen Höhe.Ein bleiches Weib singt eine traurige Ballade.***Wie schwarze Klagehändehoch aufgereckt, die Bäume, stehen sie,wie ohne Leben, ganz in Schweigen.Mit ihnen rag ich starr auf ins Finstere.In Nacht, in lebenleerer,stehen wir ohne Laut und sprechen dochzu dir, du Leben, das im Abgrunddes Himmels flimmert, stumm und inbrünstiglich.Des Leidens Hände sind eszu dir aufragend, daß sie niederränn',die Liebesträne, lebengebend,in sich uns bade, die glühende, strömende!***Nimm hin alle dunklen Tagedeiner ungestillten Brust,die dich brennt und weinen macht,wache in der langen Nacht,opfere all deine Klageund die Sehnsucht und die Lust.Und dann komm mit in den Morgenund dein Schauen sei Gebet:ach, wie stehtjede Blmne ohne Sorgen!Unterm Himmel bist auch du!Und wie Wolken ist das Leben,sie umschatten, sie umschwebennur des Himmels Licht und Ruh.***In hoher Öde wächst der Wald nicht mehr.Zu meinen Füßen brausen die Wipfel unermeßlich!Die Tiefe dampft herauf mit den großen Wolken.Herauf! Herauf! Ich gehe im Sturme heimwärts!Mein Herz brennt trunken von meiner Einsamkeit!So kämpfen die Berge bei mir! verhüllte Gipfel!Herab! Herab mit meinem schweigenden Lachenwerf ich mit dem sausenden Regen mich in die Tiefe!Und liegt mein Blick wie das ferne Liebeslächelnder Sonne bleich im jäh entschleierten Tal,als eine Gnade — eine süße Kundedahingegeben — ein flüchtiges Geschenk.Getürmt der Felsweg! Ich lieb ihn und frage nicht:Wann steig ich nieder für immer? Ich singe die Öde,die ewige Heimat der immerwährenden Wandrer!Wandernd ewig geh ich ewig heimwärts!",l00110664,"Aus ""Der Wanderer""","Weiß, Emil Rudolf",17,4,"Moderne Deutsche Lyrik. Mit einer literargeschichtlichen Einleitung und biographischen Notizen, hrsg. von Hans Benzmann. Leipzig 1904.",b'1904',"Benzmann, Hans"
352,"Fließe, Faden, fließe;Silberschifflein, schieße!fahre über, hin und her,meine Tränen sind dein Meer,meiner Seufzer Hauch dein Wind —fahr, mein Schifflein, fahr geschwind!Spule, spule, fließe;Kummerschifflein, schieße;schnell dich hin und schnelle her —hab mein Kind, mein Kind nicht mehr!Stich ins Herze, Stich und Schlag...Gott — wann wird es endlich Tag?!Schalte, Rädchen, schalte;halte, Schifflein, halte! —Muß das leere Bettchen sehnmeiner kleinen Magdalen!...Warst mein Glanz, mein Sonnenscheinund mußt nun begraben sein!Spiele, Schifflein, spiele,Meilen sind noch viele!schnelle hin und schnelle her —'s ist ein Leben, ach so leer,wie die Nacht, so bitter kalt! —will es noch nicht tagen bald?!Eile, Faden, eile,fließe ohne Weile:hier das Linnen muß noch sein,draußen für ein Kreuz aus Stein! —Ach, wenn erst Maßliebchen blühn,Primeln, Veilchen, Immergrün!...Schnurre, Rädchen, schnurre;surre, Faden, surre;Jahr wie Jahre, Tag und Nacht,bis der Tod herangewacht. —Fädlein, Rädlein, willst du gehn?ja nicht müde stillestehn!Fließe, Faden, fließe;Silberschifflein, schieße!Wie schon trüb die Lampe brennt,Leben auf den Gassen rennt —Flink, mein Schifflein — Ruck und Schlag —Gott — es ist schon wieder Tag!",l00110200,Das Kummerschifflein,"Geucke, Kurt",7,6,"Moderne Deutsche Lyrik. Mit einer literargeschichtlichen Einleitung und biographischen Notizen, hrsg. von Hans Benzmann. Leipzig 1904.",b'1904',"Benzmann, Hans"
353,"Welch ein Klappern an dem Pförtchen?Auf den Stufen wessen Schritt?Ei, wer schleicht sich in mein Gärtchen?Ist's der Liebste? Ist er's nicht?Ja wer trät auch so herein!Ja wer sollt es anders sein?In der stillen Geißblattlaube,welch ein liebes Angesicht?Ist es meine süße Taube?Ist's die Liebste? Ist sie's nicht?Angesicht voll Frühlingsschein!Ja wer sollt es anders sein?Laßt uns ihn ein wenig necken,laßt uns tun, als sähn wir nicht.Will sie etwa sich verstecken?Oder sah sie mich noch nicht?Horch, er scharrt schon mit dem Fuße,sehr verlangt ihn nach dem Gruße.Seht doch, wie sie lächeln tut!Ei du Schalk und Übermut!Guten Morgen, schönstes Dämchen!Ei wer kommt? Ach, ist es er?Dieses Lächeln, was bedeutet's?Wie neugierig ist der Herr! —Doch nun ist er ja gekommen,alles hat ja seine Zeit,mir zur Seite Platz genommen,tausend-, tausendmal willkommen,bleib er nur in Ewigkeit!",l00110676,Gartengespräch,"Wildenbruch, Ernst von",9,6,"Moderne Deutsche Lyrik. Mit einer literargeschichtlichen Einleitung und biographischen Notizen, hrsg. von Hans Benzmann. Leipzig 1904.",b'1904',"Benzmann, Hans"
354,"Das sind die schwülen Sommernächte,die fieberheiß die Stirn umwehn,da wie gefesselte Gigantendie Bäume rings im Kreise stehn.Der Nachtwind lockt aus jeder Blütedie Seele buhlerisch hervorund trägt auf seinen trunknen Armenden willenlosen Duft empor.Die Sterne zucken dort und flimmern,als trübten Tränen ihren Schein,das Bächlein schluchzt und will nicht wandern,es hält sich fest an jedem Stein.Und durch die atemlose Stilleein wunderbares Klingen zieht,ein Sang, aus Leid und Lust gewoben,ein zitternd süßes Liebeslied.",l00110522,Das sind die schwülen Sommernächte,"Ritter, Anna",4,4,"Moderne Deutsche Lyrik. Mit einer literargeschichtlichen Einleitung und biographischen Notizen, hrsg. von Hans Benzmann. Leipzig 1904.",b'1904',"Benzmann, Hans"
355,"Mein Fenster schaut auf einen düstern Hof,auf schmutzige Dächer und auf rußige Mauern,doch wer wie ich ein Stückchen Philosoph,läßt darum sich noch lange nicht bedauern.Ein wenig Luft, ein wenig Sonnenlichtdringt schließlich auch durch seine trüben Scheiben,zu hungern und zu frieren brauch ich nichtund all mein Tun ist nur ein wenig Schreiben.Ein wenig Schreiben, wenn ich stundenlangmich einlas in die Wunderwelt der Alten,bis endlich, endlich es auch mir gelang,was ich gefühlt, zum Wohllaut zu gestalten.Dann fließt es um mich wie ein Heiligenschein,und mir im Herzen bauen sich Altäre;so könnt ich glücklich und zufrieden sein,wenn ach, nur meine Nachbarschaft nicht wäre!Kein Schwärmer ist es, der die Flöte liebtund auf ihr nur ""des Sommers letzte Rose"",kein Tanzgenie, das ewig Stunden gibt,auch kein klavierverrückter Virtuose:Ein armer Schuster nur, der nächtens flickt,wenn längst aufs Dach herab die Sterne scheinen,indes sein Weib daneben sitzt und stricktund seine Kinderchen vor Hunger weinen!O Gott, wie oft nicht schon hat dieser Lautmich mitten aus dem tiefsten Schlaf gerüttelt!Und wenn ich halbwach dann mich umgeschaut,hat wild es wie ein Fieber mich geschüttelt.Des Mädchens Schluchzen und des Knaben Schreiund ganz zuletzt des Säuglings leises Wimmern —mir war's, als hörte ich dann nebenbeidrei kleine, kleine schwarze Bettlein zimmern.Mir war's, als rollte dumpf dann vor das Hausder nur zu wohlbekannte Armenwagenund jene Bettlein trügen sie hinausund luden sie in seinen düstern Schragen.Der Kutscher aber nahm noch einen Schluckund peitschte fluchend seine magren Schinderund übers Pflaster dann ging's Ruck auf Ruck,doch ach, noch immer wimmerten die Kinder!Und immer, immer noch klang's mir im Ohr,wenn schon der Morgen durch das Fenster blickte,und mir ums Auge hing einen Tränenflor,wenn ich dann stumm mein Tagewerk beschickte.Was half mir nun mein ""Stückchen Philosoph""?In Trümmer fiel, was ich so luftig baute!Doch tat's das Haus nicht, nicht der düstre Hof,nein, nur die abgebrochnen Kindeslaute! —Die Armut bettelt um ein Stückchen Brot,doch herzlos läßt der Reichtum sie verhungern;Millionen tritt die Goldgier in den Kot,und einen einzigen nur läßt sie lungern.In seidne Betten wühlt sie ihn hinein,wenn er beim Sekt sich endlich ausgeplappert,indes beim flackernden Laternenscheindas bleiche Elend mit den Zähnen klappert.O Gott, warum dies alles, o warum?Wie Zentnerlast drückt mich die Frage nieder!In meinen Reimen geht sie heimlich umund ächzt und stöhnt durch meine armen Lieder.Was bleibt mir noch auf diesem Erdenball?Denn auch die Kunst, längst stieg sie vom Kothurne —einst schlug mein Herz wie eine Nachtigall,doch ach, nun gleicht es einer Tränenurne!",l00110292,"Meine Nachbarschaft [Aus ""Buch der Zeit""]","Holz, Arno",8,8,"Moderne Deutsche Lyrik. Mit einer literargeschichtlichen Einleitung und biographischen Notizen, hrsg. von Hans Benzmann. Leipzig 1904.",b'1904',"Benzmann, Hans"
356,"Mein Lied das rollt wie Sonnengold,dem Purpurstrom des Daseins hold.Wenn violett erblüht die Nacht,flieg ich zur weiten Sternenwacht.Gedämpften Echos meld ich Streitund Menschenleid.Wo scharfes Elend Lust zerstört,schmettr und schluchz ich qualempört!Weh, wenn mein Auge Not erblickt!Ich schlage, daß der Busch erschrickt.Der Schönheit schwillt mein Klang zu Schutz,zu Schutz und Trutz.Wo einer wund von Kampf und Pein,Trostnachtigall, da tröste fein!Frisch wie der Tau gen Morgen quillt,gib Kraft und Wohllaut stark und mild!Wirf Wonnen in der Lauscher Schoß,schlag schmelzend los!",l00110255,Trutznachtigall,"Henckell, Karl",3,6,"Moderne Deutsche Lyrik. Mit einer literargeschichtlichen Einleitung und biographischen Notizen, hrsg. von Hans Benzmann. Leipzig 1904.",b'1904',"Benzmann, Hans"
357,"Es schläft die Stadt, die Regentropfen rinnenam Dachfirst nieder in verträumtem Takt,die feine Melodie zu meinem Sinnen.Die Äste, die ins Fenster ragen nackt,die zeichnen sich wie große Hieroglyphenins Himmelnachtgrau, rätselhaft gezackt.Und ich bin so allein... Aus Herzgrundtiefenstehn Wunsch und scheue Sehnsucht wandelnd auf,die ungeweckt von Leidenschaft noch schliefen.Die Heilige rief sie nun ins Licht heraufund gibt den beiden ihre Flügelkraft,und deutet ihnen Ziel und Siegeslauf...Und also fliegt mein Herz aus seiner Haft,zerbricht die Ketten, die der Zwang ihm bindet,und es beginnt die selige Wanderschaft.Und wie die Stege der Nachtwandler findet,hart an den dämmerweiten Abgrundtiefen,wenn sein Gestirn die Sehnsuchtsfackel zündet,so find ich dich, als ob mich Himmel riefen...",l00110486,Liebesterzinen,"Puttkamer, Alberta von [alt. Puttkamer, Alberta Freiin von; Puttkammer, Alberta von]",7,1,"Moderne Deutsche Lyrik. Mit einer literargeschichtlichen Einleitung und biographischen Notizen, hrsg. von Hans Benzmann. Leipzig 1904.",b'1904',"Benzmann, Hans"
358,"Woran denk ich, wenn es Abend wird?An mein fernes, fernes Vaterhaus.Hab im dichten Walde mich verirrt,finde all mein Lebtag nicht heraus.O mein Vaterhaus im fernen Vaterland,Fluch dem Armen, der sich von dir schied!Jede Blume welkt in seiner kranken Hand,jeden Freund verscheucht sein düstres Lied.",l00110312,Heimweh,"Huch, Ricarda",1,8,"Moderne Deutsche Lyrik. Mit einer literargeschichtlichen Einleitung und biographischen Notizen, hrsg. von Hans Benzmann. Leipzig 1904.",b'1904',"Benzmann, Hans"
359,"Die letzten Sterne flimmerten noch matt,ein Spatz versuchte früh schon seine Kehle,da schritt ich müde durch die Friedrichstadt,bespritzt von ihrem Schmutz bis in die Seele.Kein Quentchen Ekel war in mir erwacht,wenn mich die Dirnen schamlos angelacht,kaum, daß ich stumpf davon Notiz genommen,wenn mir ein Trunkner in den Weg gekommen.Und doch, ich spürte dumpf: mir war nichts recht,selbst die Zigarre schmeckte schlecht.Halb zwei. Mechanisch sah ich nach der Uhr,an was ich dachte, weiß der Kuckuck nur;vielleicht an meinen Affenpinscher Fips,an ein Bonmot, an einen neuen Schlips,vielleicht an ein zerbolztes Ideal,vielleicht auch nur — ans Café National.Da, plötzlich — wie? ich wüßt es selber nicht —fuhr mir durchs Hirn phantastisch ein Gesicht,ein Traum, den ich vor Jahren mal geträumt,ein Glück, das zu genießen ich versäumt.Ich fühlte seinen Atem mich umstreifen,ich konnt es förmlich mit den Händen greifen!Ein verwehender Sommertag, ich war allein,auf einem grünen Hügel hielt ich im Abendscheinund still war mein Herz und fröhlich und ruhte.Leise unter mir schnupperte meine Stute,die Zügel locker, lang und laß,und rupfte büschelweise das Gras.Es ging ihr fast kniehoch und stand voller Blumen.Dazwischen roch es nach Ackerkrumenund hinten, die Flügel noch grade besonnt,mahlten drei Mühlen am Horizont;drei alte Dinger, fuchsrot beschienenund schon halb begraben hinter einem Feld Lupinen.Sonst nichts, soweit der Blick auch schweifte,als mannshohes Korn, das rauschend reifte;dazu drüber ein ganz, ganz blaßblauer Himmelvoll Grillengezirp und Lerchengewimmel.Das war das Ganze. Doch ich sah die Farbenund hörte den Wind wehn und roch die Garben.Ein Sonnenblitz, drei helle Sekunden,gekommen — verschwunden!Die Friedrichstraße. Krumm an seiner Krückeein Bettler auf der Weidendammer Brücke:""Kauft Wachs—streich—hölzer,schwedische, Storm- und Wachs—streich—hölzer...""Mich fröstelte!",l00110293,"Tagebuchblatt [Aus ""Buch der Zeit""]","Holz, Arno",6,5,"Moderne Deutsche Lyrik. Mit einer literargeschichtlichen Einleitung und biographischen Notizen, hrsg. von Hans Benzmann. Leipzig 1904.",b'1904',"Benzmann, Hans"
360,"Die sinkende Sonne weint blutig auf starren Schnee..Leise leise hör ich dich singen, Sankta Maria...""Mein Mund ist wund und weh, ich hab ihn geküßt.Mein Leib ist krank und kalt, ich hab ihn gewärmt.Mein Herz ist hohl und tot, ich hab ihn geliebt"" ...Leise im Traum hör ich dich singen, Sankta Maria...",l00110417,"Winterabend [Aus ""Tag und Nacht""]","Mombert, Alfred",3,1,"Moderne Deutsche Lyrik. Mit einer literargeschichtlichen Einleitung und biographischen Notizen, hrsg. von Hans Benzmann. Leipzig 1904.",b'1904',"Benzmann, Hans"
361,"Meine Augen voll Asche,meine Ohren haben die Töne verloren,Bäume, Wind, Gestein,eure Sprache fällt mir nicht mehr ein,höre im Weltraum nur mich,mein wildes, hungerndes Ich.",l00110102,Meine Augen voll Asche [Reliquien],"Dauthendey, Max [Dauthendey, Maximilian; alt. Dauthendey, Maxim]",1,6,"Moderne Deutsche Lyrik. Mit einer literargeschichtlichen Einleitung und biographischen Notizen, hrsg. von Hans Benzmann. Leipzig 1904.",b'1904',"Benzmann, Hans"
362,"Nur daß ich wachte.Nur daß ich eine Fackel trug,die zuckend rot den dunklen Gang beblutete,den steinernen Gang, in dem wir wandelten.O wie ich wachte!O jeder Nerv und jeder Zoll ist wach.Und während ich hieroben gespannt die Wand beschaue,fühl ich tiefinnen hinaus — zurück den dunklen Gang!und weiß auch: ich fühle — weiß selbst, daß ich weiß!Kristalle — Kristalle — leuchtende Kristalle! —Die Seele erblindet am eignen Glanze! ...Der ganze Gang ward von mir ausgewuchert,ist ein Gewächshaus, drin meine Seele haust —ist nichts als Ausdruck! Außenform,die meine Seele launenvoll sich schuf! —Doch damals ward zugleich ewiger Schmerz geboren,ward der Gewalt ihr ewiges ""Halt!"" geboren:Sie weiß es nicht, warum sie also formte,warum nicht anders...Und wann ich jetzt die blutende Fackel ans Gewölb stieß,wußt ich:Das war in der Seele lange vorher schon getan:Von einer Urhand, die manchmal aus Urtiefendie blutende Fackel ans Gewölb stößt...Und jetzt lausch ich dem allerspätesten fernsten Echo...Nur: Ich wachte.Sie aber, düster Volk von Männern,magre Weiber, greishafte Kinderschritten schlafend, geschloßne Augen hinter mir,graue Gesichter schmerzlos stumpf,etwas seitlich neigten die schweren Häupter.Nur wann ich manchmal die blutende Fackel ans Gewölb stieß,glühende Kohlen brannten auf sie nieder,auf Gesichter schmerzlos stumpf geneigt:Es zuckte leise darunter —ach so leise...Eine Spannung —ach so leise...Ein Wissen, das kaum schon Atmen ist —ach so leise...Das allerfrüheste fernste Glänzen des Bewußt-Seins —ach so leise...",l00110418,"Nur daß ich wachte [Aus ""Der Glühende""]","Mombert, Alfred",2,17,"Moderne Deutsche Lyrik. Mit einer literargeschichtlichen Einleitung und biographischen Notizen, hrsg. von Hans Benzmann. Leipzig 1904.",b'1904',"Benzmann, Hans"
363,"Die Nächte sind lau und hangen voll Blüten!Die Säfte regen sich, schwellen und fließen, —nun möge Gott unsern Garten hütenund den Wald und das Feld, wo die Saaten sprießen.Schon rüsten sich die ersten Gewitter,die Winde fiebern am fernen Gelände...Da lehn ich am goldenen Gartengitterund breite aus meine betenden Hände.",l00110282,Andacht,"Hoffmann, Camill",2,4,"Moderne Deutsche Lyrik. Mit einer literargeschichtlichen Einleitung und biographischen Notizen, hrsg. von Hans Benzmann. Leipzig 1904.",b'1904',"Benzmann, Hans"
364,"Die Nacht ist keines Menschen Freund —Was flüsterst du von Treue?Der Mond verblaßt, der Morgen graut...Am Bette sitzt die Reue.Die Reue ist ein häßlich Weibund möcht mich wohl verderben —Reiß mir das Herz nicht aus dem Leib,ich will ja noch nicht sterben.Mein Blut ist heiß, dein Mund so süß...O Gott, wie kannst du küssen!Das hat die Sommernacht getan,daß wir versinken müssen.",l00110520,Das hat die Sommernacht getan,"Ritter, Anna",3,4,"Moderne Deutsche Lyrik. Mit einer literargeschichtlichen Einleitung und biographischen Notizen, hrsg. von Hans Benzmann. Leipzig 1904.",b'1904',"Benzmann, Hans"
365,"Der Nachtwind singt und säuselt durch das Rohr..Vom Garten hängt zum See der bleiche Flieder... Ich harre dein im Boot, wann steigst du niederdie kühlen Stufen? .. — leis.. das Gittertor.Der Nachtwind singt und säuselt durch das Rohr.Der Nachtwind streift und flüstert um das Boot..der See liegt still.. 'Schling um mich deinen Arm,gib diese junge Brust mir, keusch und warm...wie feucht dein Nacken glüht, dein Mund wie rot! ..'Der Nachtwind streift und flüstert um das Boot.Der Nachtwind zittert fröstelnd durch das Rohr.'Frühvögel.. horch..' 'wenn der Rausch je verblich?''Du weinst' 'ich weine — süß und bitterlich.'Der Mond scheint grell — leis geht das Gittertor..Der Nachtwind rauscht und schauert durch das Rohr.",l00110642,Notturno in G-Dur,"Vollmoeller, Karl Gustav",9,1,"Moderne Deutsche Lyrik. Mit einer literargeschichtlichen Einleitung und biographischen Notizen, hrsg. von Hans Benzmann. Leipzig 1904.",b'1904',"Benzmann, Hans"
366,"Ein Grasfeld, fußhoch ob der Flut erhoben;zehn dürftige Hütten, strohgedeckt und grau,geschart um eines Kirchleins morschen Bau;hier, dort ein Siel, vom Meere selbst gegraben;ein Möwenschwarm, ein gierig Paar von Raben,den Strand umflatternd auf der Beuteschau;des Seewinds rastlos Pfeifen, schrill und rauh;kein Baum, kein Busch, mit Schatten dich zu laben:Das ist die Hallig. — Nüchtern, öd und häßlichscheint sie des Weltkinds wechselndem Verlangen,doch ernsten Seelen bleibt sie unvergeßlich.Hier fühlt das Herz, verlernend Lust und Bangen,sich weiten gleich der Meerflut, unermeßlich,vom Ewig-Einen traumhaft still umfangen.",l00110187,Auf der Hallig,"Fuchs, Georg",4,3,"Moderne Deutsche Lyrik. Mit einer literargeschichtlichen Einleitung und biographischen Notizen, hrsg. von Hans Benzmann. Leipzig 1904.",b'1904',"Benzmann, Hans"
367,"Kein Erbbegräbnis mich stolz erfreut,meine Gräber liegen weit zerstreut,weit zerstreut über Stadt und Land,aber all in märkischem Sand.Verfallene Hügel, die Schwalben ziehn,vorüber schlängelt sich der Rhin,über weiße Steine, zerbröckelt all,blickt der alte Ruppiner Wall,die Buchen stehn, die Eichen rauschen,die Gräberbüsche Zwiesprach tauschenund Haferfelder weit auf und ab —da ist meiner Mutter Grab.Und ein andrer Platz, dem verbunden ich bin:Berglehnen, die Oder fließt dran hin,zieht vorüber in trägem Lauf,gelbe Mummeln schwimmen darauf.Am Ufer Werft und Schilf und Rohrund am Abhange schimmern Kreuze hervor,auf eines fällt heller Sonnenschein, —da hat mein Vater seinen Stein.Der dritte, seines Todes froh,liegt auf dem weiten Teltowplateau,Dächer von Ziegel, Dächer von Schiefer,dann und wann eine Krüppelkiefer,ein stiller Graben die Wasserscheide,Birken hier und da eine Weide,zuletzt eine Pappel am Horizont, —im Abendstrahle sie sich sonnt.Auf den Gräbern Blumen und Aschenkrüge,vorüber in Ferne rasseln die Züge,still bleibt das Grab und der Schläfer drin, —der Wind, der Wind geht drüber hin.",l00110177,Meine Gräber,"Fontane, Theodor",5,12,"Moderne Deutsche Lyrik. Mit einer literargeschichtlichen Einleitung und biographischen Notizen, hrsg. von Hans Benzmann. Leipzig 1904.",b'1904',"Benzmann, Hans"
368,"Hände, viele Händeüber der Heide schweben,die unsichtbar, ohn Endeam Tuch der Tränen weben...Die grauen Fäden gleiten,auf daß es ewig hält,die Geisterhände breitenallnacht es über die Welt...",l00110667,Tuch der Tränen,"Wertheimer, Paul",2,4,"Moderne Deutsche Lyrik. Mit einer literargeschichtlichen Einleitung und biographischen Notizen, hrsg. von Hans Benzmann. Leipzig 1904.",b'1904',"Benzmann, Hans"
369,"Fern unter Blüten vergrabenschimmern die tausend Inseln von Japan.Millionen bunte Papierlaternenüberstrahlt ein gelber Mond.Schaukelt sichin kleinen, eirunden Teichen,eingefaßt mit Perlmutterglanz und stillen Farren.Er ist selbst nur ein riesiger Lampionaus ganz dünnem Seidenpapier.",l00110504,"Fern unter Blüten vergraben [Aus ""Farben""]","Reß, Robert",1,9,"Moderne Deutsche Lyrik. Mit einer literargeschichtlichen Einleitung und biographischen Notizen, hrsg. von Hans Benzmann. Leipzig 1904.",b'1904',"Benzmann, Hans"
370,"Links, vom Herd, ein Knistern. Leise, leis.Asche wird ein letztes dürres Reis.Rechts der Wanduhr harter, fester Schlag,rastlos kreist der Zeiger durch den Tag.Zwischen beiden Mahnern sitzt und sinnteiner, der an goldnen Fäden spinnt,eine feine, hohe Brücke schlägt,die ihn über Tag und Stunden trägt.Lautlos flammt ein Feuer und erhellteine zeitentrückte heitre Welt.",l00110151,Der Dichter,"Falke, Gustav",5,2,"Moderne Deutsche Lyrik. Mit einer literargeschichtlichen Einleitung und biographischen Notizen, hrsg. von Hans Benzmann. Leipzig 1904.",b'1904',"Benzmann, Hans"
371,"Die nackten Tempel, die im Mittag starrenin ihrem Trümmerglanz und heißen Gleiße! —Erschrickst du nicht der leichenhaften Weiße,ward deine Seele noch nicht müd, zu harren,noch deine Hand, die zittert, nachzutastender steilen Säulen stets gelassenem Schwellen,die Stirn nicht müde der metallnen Hellen:So sollst du nie in dem Gewährten rastenund stets um die erhobenen Leuchten schwärmen.Fremd, ewig wandernd auf den fremden Steigendich durstig zu den fremden Brunnen neigenund immer dich an fremden Feuern wärmen!Schon ward dein Auge vom viel Schauen kühlerund dein Herzblut von langer Sehnsucht matter..Schau auf! Ein neuer Hauch weht düfteschwüler,die Dinge glänzen rund und lebenssatter,und sieh, der Abend sank, ein letzter Hort.Wie hüllt dich Dämmerung vertrauter Wände,ein Kind, ein Mädchen, rühret kühle Hände,ein Kind — im Abend — fand das rechte Wort.***Ja die Musik umfängt dich wie mit Nächten,die heilige Hochstadt wankt und dämmert fahl.Doch aus den innersten und tiefsten Schächtenfühlst du Lebendiges regelnd sich verflechten:Die Leidenschaft, gebändigt im Choral.Vor dem, was Edle tief verknüpfend schufen,vor Stimmen, die im ungeheuren Strombald aus den Höhen, bald aus Tiefen rufen,zerbricht der Tempel Säulenflucht und Stufen —Schon flammt dir im emporgerißnen Dombrünstiges Violett der mystischen Roseund blühen Fenster dir mit eigenem Glanz,wie schaust du innerlich das namenloseunendliche Kleine und unendlich Große,wie hältst du deines Volkes Seele ganzin Orgellautes tiefster Qual und Wonnen:Hier flattern Engel der verschollnen Meister,aus Flöten singen alle Märchenbronnen,und lächeln milder heimische Madonnen,und unten seufzen die gequälten Geister.Daß dir noch einmal die Erkenntnis werdedes Sakraments, wie beugst du das Genick,wie kniest du wurzelnd in erkommner Erde! ..Fern decken Nebel heidnische Gebärde.Nun bleibe so und wende nicht den Blick.Leicht daß schon bei den frühen Morgenrötenein Neues dir geheißen und geboten.Dann vor der ewigen Wandlung nicht erschrick,sieh, dies ward so dein eigenstes Geschick —und später Schlaf bei deinen großen Toten.",l00110643,"Aus ""Das Buch der Landschaften""","Vollmoeller, Karl Gustav",12,5,"Moderne Deutsche Lyrik. Mit einer literargeschichtlichen Einleitung und biographischen Notizen, hrsg. von Hans Benzmann. Leipzig 1904.",b'1904',"Benzmann, Hans"
372,"La palomela, du köstlich Lied,von Iradier, als ich zum erstenmaldich unter Südens Palmen hörte,des Tajo Wogen lind mir rauschten,und Afrika den Träumer grüßte —die dunkle Riesin ohne Herz —:Wie war ich unaussprechlich selig!Ein schönes, liebeglühendes Weibim Schatten lauschiger Kastanienpochenden Herzens mich umfingund sprach zu mir: Ich liebe dich!und ich, ich rief: Wie bin ich glücklich!Die Stunden rannen wie ein Traum.Wir hielten selig uns umschlungenund frei wie Falter buhlen, Blumenkosen — also liebten wir.Und nur der grünlich-weiße Himmel,der südlich-schöne, tausendsternige,sah unsrer Liebe süße Freuden...",l00110006,La palomela,"Arent, Wilhelm [alt. Arendt, Wilhelm]",1,19,"Moderne Deutsche Lyrik. Mit einer literargeschichtlichen Einleitung und biographischen Notizen, hrsg. von Hans Benzmann. Leipzig 1904.",b'1904',"Benzmann, Hans"
