,text,ID,Titel,Autor,Strophen,Verse,Anthologie,Jahr,Hrsg
78,"Die Dirne hat ein Kind geborenUnd liegt allein im Prunkgemach,Im Purpur ihres Pfühl's verloren,Von Qual erschlafft, von Schmerzen wach.Der Ampel blasse Ringel zitternUm einer Göttin Goldgesicht,Die von des Hausaltares FlitternDen Segen in die Halle spricht.Die lauten Buhler sind verschwunden,Kein Cymbelklang durchschwirrt die Luft,Gefährte ihren MarterstundenWar nur der heiße Ambraduft,Der schwül durch alle Kissen lagert,Der lockt, betäubt und trunken macht,Und die entsaugten Glieder hagert,Wenn in den Morgen sinkt die Nacht.Die Nacht war der zum Reich erkoren,Die jetzt des Morgens Kühlung suchtUnd ihren Leib, weil er geboren,Mit kranker Lippe herb verflucht.Die Krone, die ihr Haupt getragen,Die Schönheit, die von Lust geschmückt —Ward all' von einer Nacht zerschlagen,Was tausend Nächte nicht zerstückt?Die sie in ihrer Kraft VerschwendungVerrast und in des Giftes Trank,Da ihre Jugend, stolz der Schändung,In freche Mannesarme sank?Wär' nimmer ihr zurückgegebenDer Wonnen ungebroch'ne Gier?""O Göttin, nimm von mir das Leben,Eh' daß du Schönheit nimmst von mir!""Sie tastet, greift den gold'nen Spiegel,Die müden Augen sind bereitZu spähen, ob des Schmerzes SiegelDas weiche Angesicht entweiht.Wohl ist es bleich und scharfgezogenDer feinen Adern Blaugeäst,Gesenkt der Brau'n gepfeilte Bogen,Des Mundes Üppigkeit gepreßt.Doch ist es Nebel nur, der schleiertAuf rosenwilde Bergeshöh'n,Wenn die verschlafne Sonne feiert.Sie athmet tief: Noch ist sie schön.Sie fühlt das süße Lebensfeuer,Der Göttin schwöret sie empor,Sich zu vergeuden ungeheuerIn Rausch und Glut — da schrickt ihr Ohr.War es der eig'nen Stimme Tönen?War's im Gezweig verirrter Wind?Und wieder eines Hauches Stöhnen —Sie neigt und lauscht — es ist ihr Kind.Zu ihren Füßen nackt und bebendVom seid'nen Schleier schlecht bedeckt,Die kleinen Hände hilflos hebend,Noch nicht das Aug' zum Licht erweckt.Gehaßt, da sich sein erster SchauerGeheim geregt in ihrem Schooß,Empfangen in die ErdentrauerLiegt es verlassen, mutterlos.""Gebrandmalt hast du meine Stirne,Hinausverstoßen mich in's Leid!""Schwer trifft es, was der schönen DirneDer stumme Mund entgegenschreit.Mit zitternd ungeschickten ArmenHebt sie es leis und wiegt es sacht.Wie zart es ist! Und im ErbarmenSchmiegt sie es in des Busens Pracht.Doch glühend fühlt sie sich durchirretVon der Berührung schwachem Kuß,Daß sie, in Angst und Lust verwirret,In Thränen sich entzücken muß.Und daß im festeren UmfangenKein kalter Druck das Kind verletzt,Reißt sie vom Arm die reichen Spangen,Vom Hals die Kette steinbesetzt.Zu rauh scheint ihr der Schleier Seide,Ihr langes Haar umspielt, umgibtDen kleinen Leib mit gold'nem Kleide.Die nur gebuhlet hat — sie liebt.Sie will aus ihren sünd'gen Nächten,Die leise drängend sie umweh'n,Den Kranz für seine Stirne flechten:In Königsreichthum soll es steh'n.In seinem Tag wird sie sich schauen,In seiner Unschuld wird sie rein,Sie wird die strahlendste der Frauen,Die seligste der Mütter sein.Wann wird sein Lächeln ihr begegnen?Wann grüßet sie der erste Laut?Wann wird der erste Blick sie segnen,Der Blick, den sie noch nicht geschaut?Sie sehnt zu wecken seine Lider.Schon will sie's, scheu verlangend, thun —Wie kühl, wie schwer sind seine Glieder,Die still an ihrem Herzen ruh'n!Und schwächer wird das Athembeben,Die Wange kalt, die Lippe weiß.Und in ihr eigen heißes LebenFühlt sie des Grabes schwarzes Eis.Und hebt in schreiendem EntsetzenDie Arme zu dem GötterbildUnd reißt das Purpurtuch in FetzenUnd stürzt sich hin verstört und wild:""O Göttin, lass' es nicht geschehenDaß Tod mir raubt, was noch nicht mein!Noch hat sein Aug' mich nicht gesehen,Noch kann sein Mund mir nicht verzeih'n!Halt' auf das nachtende VerderbenDu Mächtigste, die ich verehrt —Und willst du nicht, so laß mich sterben,Und meinem Kind sei Licht gewährt!""Die Göttin starrt mit gold'nem LächelnAuf das emporgehob'ne KindUnd in die Ambraschwüle fächelnDie ersten Dämmerlüfte lind.Die großen Augen aufgedunkelt,So schaut das Kind zum ersten MalUnd aus dem Sterbeblicke funkeltEin ewigkeitentschöpfter Strahl.Mit weitem Schau'n zur weiten FerneFlieht suchend er durch's Morgenlicht,Bis er begegnet seinem Sterne,Dem letzten Stern, — das Auge bricht.Und über ihres Wahnsinns Weinen,Dem Rasen ihrer MutternothDie bleichen Morgenrosen scheinen,Mit denen sich bekränzt der Tod.Von stolzer Marmortreppe scheidetDie grau verhüllte Bettlerin,Der Schätze hat sie sich entkleidetUnd ihre Schönheit wirft sie hin.Ihr Kind will sie zu Grabe tragenWo Lilien blüh'n im Waldgefild,Und in der Halle liegt zerschlagen,Zerscherbt der Göttin goldnes Bild.",l0060079,Zu Ende,"Rosmer, Ernst",34,4,"Moderner Musen-Almanach auf das Jahr 1893, hrsg. von Otto Julius Bierbaum. München 1893.",b'1893',"Bierbaum, Otto Julius"
79,"Kein Titel schmückt meinen Namen,Kein Orden meinen Rock befleckt,Und hinter Schürzen hoher DamenHab' ich mich niemals noch gesteckt.Vier Treppen hoch bin ich geboren,Hab' oft in gleicher Höh' gehaust,Ich hab' gehungert und gefrorenUnd war verludert und verlaust.Nie fand ich Schutz und Gunst bei Mächt'gen,Sah kaum von Fern die große Welt,Oft mußt' bei Mutter Grün ich nächt'gen —Zur Miethe fehlte mir das Geld.So that ich frech die Welt durchstreifenUnd faßte ihren tiefsten Sinn —Nur kann und kann ich's nicht begreifen,Daß ich trotzdem kein Dichter bin.",l0060093,"I. Kein Titel schmückt meinen Namen [Aus dem Cyklus ""Berliner Zigeunerleben""]","Alberti, Conrad",2,8,"Moderner Musen-Almanach auf das Jahr 1893, hrsg. von Otto Julius Bierbaum. München 1893.",b'1893',"Bierbaum, Otto Julius"
80,"Narrentand und Trauerlieder!Das Jahrhundert legt sich nieder,Lüstesatt, zum lauten Sterben.Lachen —? weinen seine Erben? —Gierig schwelgen sie an Tischen,Wo des Tages Köche mischen —Daß die Stunde weich verrinne, —Kühlungstrank dem Brand der Sinne.Welch ein Leichenmahl! — Es prangenUnermeßlichstem VerlangenDie Gerichte aller Zeiten,Aller Völker, aller Breiten.Aus ErkenntnißbaumeszweigenGoldenblinkend her sich neigenFrüchte, — Paradiesesschlangen,Grimmig stachelnd das Verlangen.Doch die müden Hände zaudern,Müd von des Genusses Schaudern,Müd vom Hoffen, müd vom Streben,Müd vom ewig dunkeln Leben. —Welch ein Leichenmahl! — GelächterSchwirrt wie Hohn von der VerächterLippen in der dumpfen MassenGiergestachelt wüstes Prassen.Schwül die Luft. — Und — NarrenwitzeZucken als die ersten BlitzeOb dem schwelgenden Gewimmel.Wetter ziehen auf am Himmel. —Weihrauch qualmt. Und müde Seelen,Die des Herzens Bruch verhehlen,Flüchten in die alten, wirrenLabyrinthe, froh zu irren.Auf des Zweifels DornenbetteSingen Dichter Trauermette,Singen laut von schönern Tagen,Da die Herzen Götter tragen.",l0060075,Fin de siècle,"Weigand, Wilhelm",9,4,"Moderner Musen-Almanach auf das Jahr 1893, hrsg. von Otto Julius Bierbaum. München 1893.",b'1893',"Bierbaum, Otto Julius"
81,"Und der Abschied war kein Ende,und mein Blick bewegte dich;und es war, als legte sichstill dein Herz in meine Hände...Aber wenn du wiederkehrst,will ich deine Hand nicht küssen,will es nur empfinden müssen,wie du deinem Herzen wehrst...",l0060067,Nur,"Dehmel, Richard",2,4,"Moderner Musen-Almanach auf das Jahr 1893, hrsg. von Otto Julius Bierbaum. München 1893.",b'1893',"Bierbaum, Otto Julius"
82,"An ferne Berge schlug die DonnerkeulenEin rasch verrauschtes Nachmittaggewitter.Die Bauern zogen heim auf müden Gäulen,Und singend kehrten Winzervolk und Schnitter.Auf allen Dächern qualmten blaue SäulenGenügsam himmelan, ein lustig Gitter.Nun ist es Nacht, es geistern schon die Eulen,Einsam aus einer Laube klingt die Zither.",l0060009,Sommernacht [Sicilianen],"Liliencron, Detlev von [Liliencron, Detlev Freiherr von; alt. Liliencron, Detlev Frhr. von]",1,8,"Moderner Musen-Almanach auf das Jahr 1893, hrsg. von Otto Julius Bierbaum. München 1893.",b'1893',"Bierbaum, Otto Julius"
83,"War's nicht schon in Kindestagen.. dir floßDas Blut wie Saft im Maiensproß,Dein Träumen flog fort von der Alltagsstätte —Weckte dich nicht das Klirren der Kette?An deinem Fuß die Kette hing,Als die ersten, tastenden Schritte er ging;Du reiftest, es hat sich dein Kreis geweitet —Immer hat dich die Kette begleitet.Und wenn der Knabe die Schranke brach,Ein trotzig Wort die Lippe sprach,Nach Lieb' und Ruhm der Drang ihn verwirrte,Mahnend dazwischen die Kette klirrte.Der Knabe ward Mann, und der Mann ist klug,Der Knabentrotz riß Wunden genug:Du läßt sie heilen, du bleibst im Kreise,Kettengebannt. Sie rasselt leise.Vielleicht, zuletzt, ist die Kette das Band,Das die Träger um deinen Sarg gespannt.Er gleitet über die Verkleiung.Auf schnellt die Kette. Das ist die Befreiung.",l0060080,Unfreiheit,"Mann, L. H.",5,4,"Moderner Musen-Almanach auf das Jahr 1893, hrsg. von Otto Julius Bierbaum. München 1893.",b'1893',"Bierbaum, Otto Julius"
84,"Eine dicke Tigerschlange liegtmüde um mein Herz geringelt,ihre satten Augen thun sich zu.Einmal züngeltihre dünne Zunge noch. Sie schläft...Lebe wohl, mein blutend Täubchen Du.",l0060068,Lebe wohl!,"Dehmel, Richard",1,6,"Moderner Musen-Almanach auf das Jahr 1893, hrsg. von Otto Julius Bierbaum. München 1893.",b'1893',"Bierbaum, Otto Julius"
85,"Immer, wenn die Tage kommen,Wo die Rosen sind erglommen,Wo die roten Rosen blühn...Weht ein Hauch von GlückbegehrenMit den schweren, düfteschwerenLüften aus dem Gartengrün.An der Grotte warmversunkenHab' getrunken ich, getrunkenMeinen alten Rosentraum...Eidechs mit der goldnen KroneSpielte Schah auf sonn'gem Throne,Spielte Schah am Grottensaum.Wo die stillverschwieg'nen VillenSich in Büsche halb verhüllen,Wo kein greller Trubel schreckt...Von Guirlanden eine Gasse,Leiten Blumen zur Terrasse,Und der Springbrunn rauscht versteckt...Wandl' ich gerne meine Pfade,Wenn des Gärtners Hand zum BadeDen geschornen Rasen sprengt...Abendschatten auf den Zweigen,Die bespritzten Blüthen steigen,Die der weiße Tag versengt.Löse dir ein Boot und fahreRudernd in die mondenklare,Warme Sommernacht hinein.Wo von Quai zu Quai die breiteMondesleuchtbahn streift, da gleiteSchweigend in den Wellenschein!Von den Brückenlichtern malenSich im Wasser Glutspiralen,Zitternd strahlen sie zum Grund...Grüne Dampferaugen glimmen;Mit verhalt'nen FrauenstimmenGibt der See sein Echo kund.",l0060031,Rosentage,"Henckell, Karl",12,3,"Moderner Musen-Almanach auf das Jahr 1893, hrsg. von Otto Julius Bierbaum. München 1893.",b'1893',"Bierbaum, Otto Julius"
86,"Nimm die Feder in die Hand!Schreib!Treu der Wahrheit zugewandtBleib!Schlag' die Lüge todt, das Schand-Weib!",l0060025,Motto,"Henckell, Karl",1,6,"Moderner Musen-Almanach auf das Jahr 1893, hrsg. von Otto Julius Bierbaum. München 1893.",b'1893',"Bierbaum, Otto Julius"
87,"Eine silberklare Mondessichelhoch im Blau des heitren Abendhimmels,blinkt ins Boudoir des Colombinchensdurch die Flügelthüren der Veranda.Gegenüber in dem Riesenspiegelmalt sich wie das Sinnbild frohen Friedens —eine silberklare Mondessichelhoch im Blau des heitren Abendhimmels.Vor dem Spiegel steht Pierrot, der Eitle,stolz auf seine schlanken, weißen Glieder...Plötzlich lacht er hell —: auf seinem Haupteglänzt als Diadem, brillantenfunkelnd —eine silberklare Mondessichel.",l0060125,"Im Spiegel [Aus ""Pierrot lunaire""]","Hartleben, Otto Erich [alt. Hartleben, O. Erich; Hartleben, Erich] [Orig. von Giraud, Albert]",3,5,"Moderner Musen-Almanach auf das Jahr 1893, hrsg. von Otto Julius Bierbaum. München 1893.",b'1893',"Bierbaum, Otto Julius"
88,"Der letzte Blaue flog aus dem Haus,Zu Ende sind die Moneten:Nun, Mädel, ein Herz — und das Armband heraus,Und schnell zu Onkel Peten!Kein Geld — das ist eine dumme Geschicht:Wir wollen nicht schlemmen und prassen,Doch ohne Champagner kann ich nichtDen Tag vorüber lassen.Heut vor zwei Jahren — weißt du nicht mehr?Bei Kroll auf dem Maskenballe?Ein Dutzend Verehrer um dich her,Du aber schnittest sie alle.In Ohnmacht fiel der ganze Schwarm:Kaum sah ich dich, herzigste Trude,So nahm ich dich einfach beim linken Arm,Und fort nach meiner Bude! ....Na frisch, du Kleine! Ich glaube, du heulst?Mit Perlen der Tugend dich schmücke!Geh', geh'! und wenn du ein bischen dich eilst,Bist du noch vor Abend zurücke!Das Gold ist Chimäre! Ein thöricht GemüthHängt so an irdischen Schätzen —Der nächste Verehrer, der dir erblüht,Wird dir Alles dreifach ersetzen! —",l0060095,"III. Der letzte Blaue flog aus dem Haus [Aus dem Cyklus ""Berliner Zigeunerleben""]","Alberti, Conrad",6,4,"Moderner Musen-Almanach auf das Jahr 1893, hrsg. von Otto Julius Bierbaum. München 1893.",b'1893',"Bierbaum, Otto Julius"
89,"Wo wohnst du nur, du dunkler Laut,du Laut der Gruft?Was rinnt und raunt durch Schilf und Duftund glüht wie Augen durch die Luft,durch Rohr und Kraut...Es lehnt die Nacht am offnen Thorund weint und winkt.Zwei graue Hunde stehn davorund lauschen mit geneigtem Ohr,wie's klingtlockt blinkt.",l0060066,Über den Sümpfen,"Dehmel, Richard",2,6,"Moderner Musen-Almanach auf das Jahr 1893, hrsg. von Otto Julius Bierbaum. München 1893.",b'1893',"Bierbaum, Otto Julius"
90,"Als Erster an das Ziel gekommen,Das Pferd verendet an dem Tag:Der Reiter hat den Preis bekommen,Der Ritter unterlag.",l0060115,Distanzritt: Berlin — Wien 1892 [Epigramme],"Wohlmuth, Alois",1,4,"Moderner Musen-Almanach auf das Jahr 1893, hrsg. von Otto Julius Bierbaum. München 1893.",b'1893',"Bierbaum, Otto Julius"
91,"Nur wirken, und nicht denken:Fort Alles, was uns quält!Mußt selbst den Werth dir schenken,Den dir das All verhehlt —Im Kampfe wacker liegen,Nicht hinter'm Ofen faul!Gebrat'ne Tauben fliegenDem Troddel nur in's Maul.Lass' Träumern und SchlaraffenDen Philosophendunst —Selbst eine Welt zu schaffen,Das ist die echte Kunst!Wir brauchen keinen Retter,Der uns're Ketten bricht:Sind wir erst selber Götter,Brauchen den Gott wir nicht!Und drangen wir als MeisterIn feurigem Bemüh'nZum schaffenden Geist der GeisterEmpor gigantenkühn,Dann grüßt er seine RiesenMit doppelter Lieb und Lust,Weil er den Weg nicht gewiesen:Weil wir ihn selbst gewußt!",l0060081,Beherzigung,"Gumppenberg, Hanns von",3,8,"Moderner Musen-Almanach auf das Jahr 1893, hrsg. von Otto Julius Bierbaum. München 1893.",b'1893',"Bierbaum, Otto Julius"
92,"Aus brütender WogenTonlosem ZerfallenAufdürsten graniteneFelsencolosse.Weißglühend verrauchtStarr im ZenithDer Lichtball der Erde.Zurückfloh das Leben.Kein Laut, kein Hauch —Nur stillgeheimesGranitkornzerleckenDie Tiefe hinab.Und an berstender SteinfirstDumpf-gieriges NagenUnsichtbaren Zahnes.Vorbeirauscht die Zeit.Nur leise, ganz leiseUnsehbar, unhörbar,Jahrhunderte während,Ein langgezogenesHohles Verröcheln —Gleich müd und müderVerblutend verzuckendemSinken und HebenGebrochener Flügel...",l0060040,Eiland des Todes,"Scharf, Ludwig",6,9,"Moderner Musen-Almanach auf das Jahr 1893, hrsg. von Otto Julius Bierbaum. München 1893.",b'1893',"Bierbaum, Otto Julius"
93,"Zum Thron hat sich Amor den Schädelder Menschen bestelltUnd spottet mit schamlosem Lächelnnun Gott und der Welt! ...Behaglich hauchet er Blasenzum Himmel empor,Sie steigen — als suchten zum Ziel sieder Sterne Chor.Das schimmernde zarte Gebildeden Äther gewinnt,Es platzt — und ein Lichttraum — die Seelezu nichts zerrinnt.Ich höre des Schädels Geseufze,und flehenden Schrei""Dies Spiel, das so grimmig und thöricht —Wann ist es vorbei?Denn was in die Lüfte du schleuderstmit schamlosem Muth —Du mörderisch Scheusal — mein Hirn ists, —mein Fleisch und mein Blut.""",l0060123,Amor und Schädel,"Dörmann, Felix [Orig. von Baudelaire, Charles]",5,4,"Moderner Musen-Almanach auf das Jahr 1893, hrsg. von Otto Julius Bierbaum. München 1893.",b'1893',"Bierbaum, Otto Julius"
94,"Geh' stiller, meines Herzens Schlag,Und schließt euch, alle meine Wunden —Denn heute ist mein letzter Tag,Und dies sind seine letzten Stunden! ...***Verstumme, klägerischer Mund!Beschwichtige dich, Rebell: Gedanke!Ich schließe heute einen Bund,Der setzt euch Beiden eine Schranke.Jawohl, Empörer, es ist aus!Die Kraft, die euch erhielt, verdorrte —Wie bald, und leer steht euer Haus!Schon schloß sich seine morsche Pforte...***Was willst du, Leben, noch von mir?Nein, deine Macht hat sich verloren.Ich sage lächelnd Abschied dir:Mich hat dein Sieger auserkoren.Schon steht er wartend. Und er reißtVon meiner Lippe Deinen Becher.Dort klirrt er hin — in Trümmern gleißtSein Glanz nur dem bestohlenen Zecher.Der lehnt die kalte Stirn zurück...Und in die ungeheuren WeltenSchaut er mit einem letzten Blick,Dem alle Nächte sich erhellten! —***Mir wird kein letzter Wunsch gewährt;Nichts lindert diese letzten Leiden...Roh ward der Becher ausgeleert —Noch sterbend muß ich mich bescheiden.Doch dürfte ich den letzten TagMit einem letzten Wunsche füllen,So möge mir sein hastiger SchlagNoch einmal dieses Bild enthüllen:***Es war ein durstiger SonnentagUnd Herbst schon... Hoch im Rebgelände,Von wo das Auge schauen magWeit in die Welt, weit — ohne Ende — —Dort lagen wir, dicht, Brust an Brust...In Sehnsucht jahrelang geschiedenUnd ihrer Kraft noch unbewußtFand unsere Liebe hier den Frieden.Du schwiegst — ich schwieg... dann sprach ich leis,Und sprach von Allem, was ich dachte...Herz wurde mir und Wange heiß...Es küßte mich Dein Mund und lachte...Und langsam losch des Tages Schein —Wir sahn des Stromes stilles Fließen...Ich starb in Glück — und du wardst mein,Mein in berauschendem Genießen! — —***Geh' stiller, meines Herzens Schlag!Und schließt euch, alle meine Wunden —Denn heute ist mein letzter Tag,Und dies — sind seine letzten Stunden! ...",l0060056,Der letzte Tag,"Mackay, John Henry",18,4,"Moderner Musen-Almanach auf das Jahr 1893, hrsg. von Otto Julius Bierbaum. München 1893.",b'1893',"Bierbaum, Otto Julius"
95,"Nächtlich durch meine TräumeDa lockts wie Wachtelschlag,Da zuckts wie WetterleuchtenVor jungem Frühlingstag.Und weiße Hände legenSich auf die heiße StirnUnd feuchte Küsse kühlenMein fieberglühend Hirn.Und vor mir steht ein blassesVergrämtes MädchenbildUnd blickt mich an mit AugenSo groß, so wundermild.Und flüsternd klagt's: warum esDenn so gekommen sei?Da stöhn ich auf und röchleVerzeih!",l0060055,Nächtlich durch meine Träume...,"Schaumberg, Georg",4,4,"Moderner Musen-Almanach auf das Jahr 1893, hrsg. von Otto Julius Bierbaum. München 1893.",b'1893',"Bierbaum, Otto Julius"
96,Der Mann hat tausend Dinge getrieben;Wir sind seit Eva uns treu geblieben:Wir lieben Adam und lassen uns lieben.,l0060118,Das Ewig-Weibliche,"Towska, Kory",1,3,"Moderner Musen-Almanach auf das Jahr 1893, hrsg. von Otto Julius Bierbaum. München 1893.",b'1893',"Bierbaum, Otto Julius"
97,"Ein großer Rabe, auf den Ast gedrückt,Sticht ab als einziger Farbenstrich im Schnee,Nein doch! ein altes Mütterchen, gebückt,Im Wind wie roth die Nase, Jemine,Kommt mühsam, hüstelnd, trippelnd angerückt.Im Schürzentuch die Linke, Frost thut weh,Hält rechts sie einen Teller, kühn geschmücktMit eines sauern Herings Glorie.",l0060006,Winterbild [Sicilianen],"Liliencron, Detlev von [Liliencron, Detlev Freiherr von; alt. Liliencron, Detlev Frhr. von]",1,8,"Moderner Musen-Almanach auf das Jahr 1893, hrsg. von Otto Julius Bierbaum. München 1893.",b'1893',"Bierbaum, Otto Julius"
98,"Ich grüße euch, ihr Dächer grau,So klug in Busch und Flieder;Zur Heimath strebt mein rascher Fuß,Zur trauten Heimath wieder.Noch kräuselt still des Herdes HauchBlaugrau am rothen Himmel,Noch ruft, wie einst, zu Bitt' und BußDes Thürmchens fromm' Gebimmel.Ein Fensterlein — im Abendglanz —Erstrahlt an Stall und Stübchen;Harmonika — Melancholie —Im Redder spielt's ein Bübchen.Ein grüner Weg — verschwieg'ner Gang —Der Feld- und Herzensdiebe,Da lernt' ich einst, so dumm, wie dreist,Die schwere Kunst der Liebe.Dem Meister lief die Zeit daher,Ich wurde fett und fetter;Doch gerne denk', in stiller Rund',Ich an das grüne Redder.Schreit' ich auch heut, als Tugendbold,Des süßen Lasters Wege:Ein lieb' Gesicht lacht links und rechtsAus grünem Blattgehege.",l0060017,Grünes Redder,"Kröger, Timm",6,4,"Moderner Musen-Almanach auf das Jahr 1893, hrsg. von Otto Julius Bierbaum. München 1893.",b'1893',"Bierbaum, Otto Julius"
99,"Nun weißt du, Herz, was immer soin deinen Wünschen bangt und glüht,wie nach dem ersten Sonnenschimmerdie graue Nacht verlangt und glüht,und was in deinen Lüstennach Seelen dürstet wie nach Blut,und was dich jagt von Herz zu Herzaus dumpfer Sucht zu lichter Gluth.In früher Morgenstundehielt heut ein Alb mich schwer umstrickt:aus meinem Herzen wuchs ein Baum,o wie er drückt! er schwankt und nickt;sein seltsam Laubwerk thut sich auf,und aus den düstern Zweigen rauschtmit großen heißen Augenein junges Vampyrweib — und lauscht.Da kam genaht und ist schon daApoll im Sonnenwagen;es flammt sein Blick den Baum hinan,die Vampyrbraut genießt den Bannmit dürstendem Behagen.Es sehnt sein Arm sich wild empor,vier Augen leuchten trunken;das Nachtweib und der Sonnenfürst,sie liegen hingesunken.Es preßt mein Herz die schwere Lastder üppigen Sekunden,es stampft aus mir der Rosse Hast, —er hat sich ihr entwunden.Schon schwillt ihr Bauch von seiner Frucht,hohl fleht ihr Auge: bleibe!Er stößt sie sich vom Leibe,von Ekel zuckt des Fußes Wucht, —hinras't des Wagens goldne Flucht.Es windet sich im Krampfeund stöhnt das graue Mutterweib,mit ihren Vampyrfingern gräbtsie sich den Lichtsohn aus dem Leib,er ächzt — ein Schrei — Erbarmen: ich,mich hält der dunkle Arm umkrallt,da bin ich wach — — doch hör' ich,wie noch ihr Fluch und Segen hallt:Drum sollst du dulden dies dein Herz,das so in Wünschen bangt und glüht,wie nach dem ersten Sonnenschimmerdie graue Nacht verlangt und glüht,und sollst in deinen Lüstennach Seelen dürsten wie nach Blut,und sollst dich müh'n von Herz zu Herzaus dumpfer Sucht zu lichter Gluth!",l0060058,Bastard,"Dehmel, Richard",6,8,"Moderner Musen-Almanach auf das Jahr 1893, hrsg. von Otto Julius Bierbaum. München 1893.",b'1893',"Bierbaum, Otto Julius"
100,"Nimmer wird er wiederkommen,Der Messias hoch und rein.Wahrlich, über diese FrommenMöcht' ich auch nicht Herrgott sein.",l0060101,Messias [Epigramme],"Bernstein, Max",1,4,"Moderner Musen-Almanach auf das Jahr 1893, hrsg. von Otto Julius Bierbaum. München 1893.",b'1893',"Bierbaum, Otto Julius"
101,"Der Herr Wirth hier — Kinder, der Wirth hat Wein!aber laßt noch, stille noch, schenkt nicht ein,ich muß euch mein Lied vom Kummer erst singen.Wenn der Kummer kommt, wenn die Saiten klagen,wenn die graue Stunde beginnt zu schlagen,wo mein Mund sein Lied und sein Lachen vergißt,dann weiß Keiner, wie mir ums Herz dann ist,dann woll'n wir die Kannen schwingen —die Stunde der Verzweiflung naht.Herr Wirth, dein Keller voll Wein ist dein,meine lange Laute, die ist mein,ich weiß zwei lustige Dinge:zwei Dinge, die sich gut vertragen:Wein trinken und die Laute schlagen!eine Kanne Wein zu ihrer Zeitist mehr werth als die Ewigkeitund tausend Silberlinge!Die Stunde der Verzweiflung naht.Und wenn der Himmel auch ewig stehtund die Erde noch lange nicht untergeht:wie lange, du, wirst du's machen?du mitsammt deinem Silber-und-Goldklingklange?kaum hundert Jahre — das ist schon lange!Ja: leben und dann mal sterben, wißt,ist Alles, was uns sicher ist;Mensch, ist es nicht zum Lachen?!Die Stunde der Verzweiflung naht.Seht ihr ihn? seht doch, da sitzt er und weint!seht ihr den Affen? da hockt er und greint,im Tamarindenbaum — hört ihr ihn plärren?über den Gräbern, ganz alleine,den armen Affen im Mondenscheine? —Und jetzt, Herr Wirth, die Kanne zum Spund!jetzt ist es Zeit, sie bis zum Grundauf Einen Zug zu leeren — —die Stunde der Verzweiflung naht.",l0060120,Chinesiches Trinklied,"Dehmel, Richard [Orig. von Li-tai-po]",4,9,"Moderner Musen-Almanach auf das Jahr 1893, hrsg. von Otto Julius Bierbaum. München 1893.",b'1893',"Bierbaum, Otto Julius"
102,"Deine Augen, deine lieben blauen Augen,draus naiven Goldes Sternenblicke leuchten,deine Augen, voll so tiefen, klaren Glanzes,drinnen dennoch — flüchtig und verstohlen —mitten unter den frommen Mädchengedankendeines ruhig schlagenden jungen Herzens —plötzlich ein boshaftes Irrlicht flackernd aufspringt...deine Augen rufen mir in das Gedächtniseine Procession zurück von Kindern und Jungfraun,die durch gelbe, glühend heiße Felder zog,als die Sonne freudig auf sie niederlachte...Zitternd, mit des jungen Rehwilds scheuen Augen,schweigend, unterm Schnee der weißen Spitzenziehn sie langsam wie ein Mousseline-Nebelüber die rosig silbern leuchtende Straße —und wie im Traum singen sie Ave Maria...Aber sie sehn nicht, diese Kinder und Jungfraun,daß ein frisirtes Äffchen, ein Nüsseknacker,ausstaffirt mit Meßhemd und mit Stolahinter ihnen her mit tückischen Blickenspringt und auf die heiligen Kerzen pustet,während es zierlich die reiche Robe vom Boden aufhebt.",l0060124,Parodie,"Hartleben, Otto Erich [alt. Hartleben, O. Erich; Hartleben, Erich] [Orig. von Giraud, Albert]",2,11,"Moderner Musen-Almanach auf das Jahr 1893, hrsg. von Otto Julius Bierbaum. München 1893.",b'1893',"Bierbaum, Otto Julius"
