,text,ID,Titel,Autor,Strophen,Verse,Anthologie,Jahr,Hrsg
0,"Wer trat in Deutschland die Wahrheit in den Staub?Die Philosophen, mit Verlaub!Wer hat in Deutschland den lieben Gott erschlagen?Die Theologen, um's kurz zu sagen!***Verrammelt sitzen sie und breitIn ihren dumpfigen Schreiberstuben,Die Väter und die BubenIch aber rufe: ""So seid doch gescheidt!Die Thore auf sperrangelweit!Was nützt euch die Schildwacht vor den Thoren,Wenn innen schon auf den CorridorenGewappnet schreitet die neue Zeit?""",l0060105,Sprüche,"Ziel, Ernst",3,8,"Moderner Musen-Almanach auf das Jahr 1893, hrsg. von Otto Julius Bierbaum. München 1893.",b'1893',"Bierbaum, Otto Julius"
1,"Eine Düne.Auf ihr,Einsam,Ein Haus,Draußen Regen,Ich am Fenster.Hinter mir,Tiktak,Eine Uhr,Meine StirnGegen die Scheibe.Nichts.Alles vorbei!Grau der Himmel,Grau die See,Und grauDas Herz.",l0060033,Herbst,"Holz, Arno",5,4,"Moderner Musen-Almanach auf das Jahr 1893, hrsg. von Otto Julius Bierbaum. München 1893.",b'1893',"Bierbaum, Otto Julius"
2,"Frühling im Garten! — In dufttrunkner Helle,Farbensatt schimmernd, blinzelt er da...Heissa, wie jubelt und jauchzt die KapelleLustig ihr Trallala, Trallala — la.Hinten, da grüßen Bäume und Felsen,Spiegeln sich glitzernd im welligen Bett;Schwäne gleiten mit steifen Hälsen,Damen und Herren spazieren kokett.Rauschende Kleider, Lachen und Schreien,Männlein und Weiblein, Blicke voll Gluth,Wandeln allein oder lauschig zu zweienFrühlingsgeputzt um die spiegelnde Fluth.Blinde auf Bänken, Kranke auf Krücken,Dazwischen hinhuschend hie und daLautlos der Tod mit Erlöserblicken...Lustig jauchzt weiter das Trallala — la...",l0060050,Im Kurgarten,"Jacobowski, Ludwig [Jakobowsky, Ludwig]",4,4,"Moderner Musen-Almanach auf das Jahr 1893, hrsg. von Otto Julius Bierbaum. München 1893.",b'1893',"Bierbaum, Otto Julius"
3,"Tief in der Erde SchooßSchlagen wir Kohle los,Fern von der Sonne erquickendem Licht,Ach, wie unendlich lang dauert die Schicht!Tief in der Erde SchooßElend ist unser Loos.Tief in der Erde SchooßKauern wir nackt und bloß,Schwingen die Haue, gebadet im Schweiß —Wie ist die Luft doch so dumpfig und heiß! —Tief in der Erde SchooßTrifft uns des Todes Stoß.Tief in der Erde SchooßGehet das Unrecht bloß,Frißt an des Volkes gesundestem Stamm,Wie an den Stützen des Hauses der Schwamm.Tief in der Erde SchooßZeigt sich die Habsucht bloß.Tief in der Erde SchooßDröhnet ein wild Getos:""Lange waren wir hungernde Knechte,Laßt uns erneuern die alten Rechte!"" —Tief in der Erde SchooßDröhnet ein wild Getos.Und aus der Erde SchooßSteiget ein Riese groß,Über das Unrecht mit wuchtigem TrittSchreitet zermalmend sein mächtiger Schritt —Tief aus des Volkes SchooßSteiget der Zukunft Loos.",l0060097,Tief in der Erde Schooß,"Seidel, Robert",5,6,"Moderner Musen-Almanach auf das Jahr 1893, hrsg. von Otto Julius Bierbaum. München 1893.",b'1893',"Bierbaum, Otto Julius"
4,"Vom Baum der Menschheit nur ein angefaultes Blatt,Das von dem grünen Laube ausgestoßen,So fall ich langsam,LangsamIns Unendliche.Wenn der Wind durch die Wälder seufzt,Und vor der rauschenden LindeEin angefaultes BlattHerniedersinkt,Dann kauert obenDie kühle Nacht,Und unten ruhenGräber.So kauert obenDie kühle Nacht,Und unten ruhenGräber,Wenn ichVom Baum der Menschheit nur ein angefaultes Blatt,Das von dem grünen Laube ausgestoßen,Langsam falle,LangsamIns Unendliche...",l0060051,Faules Blatt,"Jacobowski, Ludwig [Jakobowsky, Ludwig]",3,10,"Moderner Musen-Almanach auf das Jahr 1893, hrsg. von Otto Julius Bierbaum. München 1893.",b'1893',"Bierbaum, Otto Julius"
5,"Der Hungertod im Schnee auf Haiden istEin lustig Schwelgefest in Hochgenüssen,Viel Klafter tief im Sarg erwachen istEin fröhlich Augenauf zu Glücksergüssen,Der höllischen Verdammnis Schrecken ist,Ein Rosengarten unter Frühlingsküssen,Denk' ich daran, wie Herz und Seel' es frißt,Stündlich der Geldnoth ins Gebiß zu müssen.",l0060011,Qualvollstes Sterben [Sicilianen],"Liliencron, Detlev von [Liliencron, Detlev Freiherr von; alt. Liliencron, Detlev Frhr. von]",1,8,"Moderner Musen-Almanach auf das Jahr 1893, hrsg. von Otto Julius Bierbaum. München 1893.",b'1893',"Bierbaum, Otto Julius"
6,"Es soll mit der Zeit die Schule gehn,Mit ihr, der vorwärts winkenden,Am Born des Lichtes trinkenden.Sie soll der Zeit die Spule drehn,Der werdenden, nicht der sinkenden.Ein Saatfeld soll sie, breit gepflegt,Für dieser Tage Samen sein,Soll's in der Zukunft Namen sein.Und daß sie zu Bürgern der Zeit uns prägt,Das soll ihr tägliches Amen! sein.Ihr aber, Kathederzöpfe ihr,Ihr ganz in Scholastik VerlorenenUnd drum von der Kirche Erkorenen,Stumpf macht ihr die schärfsten Köpfe schier,Die zu was Besserm geborenen.Die Bibel ist wohl ein gutes Buch,Doch wie sie heute zünftig ist —Wir wollen nicht, daß sie es künftig ist!Zu Einem nur zieht uns des Blutes Zug:Zu glauben, was vernünftig ist.Zu viel ist in Griechisch, Latein geschehn;Gebt uns statt des Todten Lebendiges,Gebt uns Modernes, Verständiges,Und wollt euch endlich eingestehn:Im Leben regiert Notwendiges!Drum thut vor allem die Pfaffen abIm Lehramt hoch und niederig,Die Pfaffen glatt und widerig!Thut ab, thut die Schlaraffen ab,Die Spinnen tausendgliederig!Ihr seid fürwahr! ein kleinlich Geschlecht,Ihr ewig lateinisch Leimenden,Ihr credo mit cedo Reimenden!Ihr macht die Geister ""hübsch reinlich"" zurechtUnd mordet den Geist, den keimenden.Der Same, den ihr in die Massen streut,Erzieht uns den kriechenden Kämmerling,Den ganz verkirchlichten Dämmerling!Schon reichen sich auf den Gassen heutDie Hände nur Schwächling und Jämmerling.Und meint ihr, es solle so weiter gehn?Uns lebt ein freiheitforderndes,Ein heißes Jahrhundert, ein loderndes.In Flammen wird bald die Scheiter stehn,Die Faules verzehrt und Moderndes.Nicht steht, was geistig, hienieden still,Und jocht ihr's mit Priestern und ""Gnädigen"",So werden's die Fäuste erledigen.Und dies soll wer da Frieden will,Auf allen Märkten predigen.",l0060103,Den Schulfüchsen,"Ziel, Ernst",10,5,"Moderner Musen-Almanach auf das Jahr 1893, hrsg. von Otto Julius Bierbaum. München 1893.",b'1893',"Bierbaum, Otto Julius"
7,"Markt vor Jerusalem und Volksgedränge...""Die Ehebrecherin! Auf! Steinigt sie!""""Nein! Nackt an's Kreuz mit ihr!"" ""Das Weib muß bluten —Nur nicht gefackelt!"" — Halt! — ""Da kommt der Rabbi,Der weise Rabbi kommt, der soll uns predgen!""""So gib doch Antwort, Mann von Nazareth,Du bist doch sonst — — Bist seltsam heut befangen!""Er schweigt und sinnt, der bleiche, hagre Mann,Wehmütig zuckt's um seine blassen Lippen,Er schweigt. — ""Du willst nicht reden? Gib uns Rath"" ...""Wer ohne Sünde unter Euch, der werfeDen ersten Stein auf sie."" Er blickt sie anEr blickt sie müde an, er seufzt und schweiget.Als hätt' er mehr zu sagen...— — — — — — — — — — — — —""Franziska, du! Du eines andern Weib —!Hast mir das Leben bettelarm gemacht!Was bleibt mir noch? Ich komme aus der Fremde,Und seh', daß du — — Weißt du nicht mehr, Franziska,Den Abend — da im Park — ""ich lieb' dich"", sprachst du.""""Ernst! Hör' mich an! Du weißt nicht, kannst nicht wissen —Es ist nicht wahr, daß ich den andern liebe.Dich lieb' ich, hörst du? Glaube doch, dich lieb' ich!""""Wie? bist du rasend?""""Ernst, ich liebe dich!"" —— — — — — — — — — — — — — —""Wie lind die Luft! Du hängst in meinem Arme,Wie damals, weißt du noch?, so ganz wie damals,Da sich zum ersten Mal die Lippen fanden.Wie damals blickt dein braunes Aug' mich an...Gib einen Kuß mir, einen! — — Wie du lieb bist..Jetz küss' ich dich! Küss' dich auf beide Augen.""""Nein, laß mich, Ernst. Ich bin — so — überselig —So — müde... Laß an deiner Brust mich schlafen.""""So komm! Das Moos ist weich: wir setzen uns.Wie schwül es ist. Siehst du? Kein Blättchen regt sich...Nein! lege nicht den Kopf auf meine Schulter,Daß mich dein Athem streift. Ich — ich ertrag's nicht!""""Warum nicht Emst?""""Weil ich — weil ich dich liebe!""""Noch immer?""""Kannst du zweifeln?""""Böser, Lieber —Dein bin ich... Laß doch! .. dir gehör' ich.. du...""— — — — — — — — — — — — — —Sie brauchen Licht, die Blumen allesammt.Sie brauchte viel Licht, meine blasse Blume.Sie haben des Lichtes sie beraubt. Sie habenMit Steinen sie geworfen, ausgestoßen,Geschmäht, gelästert meine blasse Blume.Da senkte sie das Köpfchen — welkte — starb — —.— — — — — — — — — — — — — —Wann? frag ich, wann soll uns der Heiland kommen,Der es bekennt, vor allem Volk es predigt:""Ich finde keine Schuld an ihr!"" —",l0060024,Die Ehebrecherin,"Heilborn, E.",8,3,"Moderner Musen-Almanach auf das Jahr 1893, hrsg. von Otto Julius Bierbaum. München 1893.",b'1893',"Bierbaum, Otto Julius"
8,"Jüngst sah den Heiland in weißem GewandIch schreiten durch goldenes Ernteland.Die gelben Halme von Segen schwer,Es lachte in Meeren blaßgolden her,In heißer flimmernder Sommerglut,Der reife Segen in seiner Hut.Er ging dahin mit ruhigem Schritt,Und Lerchengrüße wanderten mitAus Himmelsblau voll SeligkeitDer leuchtend stillen Sommerszeit.Nur einmal brach er ein Röslein vom RandDes Rains, der ganz voll Blumen stand,Stand still und roch, sich neigend, dran,Dann hub er wieder zu schreiten an.Doch wundersam war sein Gesicht:So schön und rein sah ich's noch nicht.Strahlend und siegreich wie des ApollUnd doch der klarsten Güte voll,Die alle Schmerzen überwunden,Die qualverzweifeltsten der Stunden;Die nichts von Bitterniß mehr kennt,Nur wie ein adlig Feuer brenntIm Herzen, das krystallenreinDas Bild der Welt schließt segnend ein.Und wundersam: — von den Menschen allen,Auf die nur je mein Blick gefallen,Die einst ich sah in Kraft beglückt,Die tief ein Kümmerniß bedrückt,Fand ich verklärt einen leisen Zug,Den er auf seinem Antlitz trug. — —Und wo er trat auf weißen Wegen,Da heimsten die Menschen den ErntesegenBei feierlichstem SichelklangDie sommerklaren Tage lang,Im Frieden kraftvoll, glücklich stark,Ein rein Geschlecht voll Heldenmark. —Und vor dem Dörflein, auf leuchtendem Plan,Wo silbern ein Brünnlein rauschend rann,Da hielt der Heiland die Schritte an.Da saßen die Alten und sahen zuDem Erntetreiben in stiller Ruh,Und silberner Kinderstimmen SchallVermischte sich mit des Brünnleins Fall.Der gleiche Ernst auf KindermienenUnd Runzelgesichtern, sonnbeschienen,Im Aug' die feierlichste Ruh. — —Ein Weilchen sah der Heiland zuZum leisen Segnen erhob er die Hand.Dann schritt er weiter im weißen GewandDurch golden schimmerndes Ernteland.",l0060070,Gesicht,"Weigand, Wilhelm",1,50,"Moderner Musen-Almanach auf das Jahr 1893, hrsg. von Otto Julius Bierbaum. München 1893.",b'1893',"Bierbaum, Otto Julius"
9,"""Verstand ist selten bei Tenören,""Kriegt Cantarelli oft zu hörenUnd stellt sich dümmer als nothwendig, — bloß,Damit man sagt, er sei als Sänger groß.",l0060106,Eitelkeit [Epigramme],"Wohlmuth, Alois",1,4,"Moderner Musen-Almanach auf das Jahr 1893, hrsg. von Otto Julius Bierbaum. München 1893.",b'1893',"Bierbaum, Otto Julius"
10,"Der Himmel dunkelte noch immer,ich fühlte tief bis in mein Zimmerder tiefen Wolken vollen Schooß;die Esche drüben drehte schwerdie hohe Krone um sich her,zwei Blätter trieben wirbelnd los.Laut tickte durch die schwüle Stube,wie durch die stille Todtengrubeder Holzwurm ticken mag, die Uhr.Und durch die Thüre hinter mirklang dünn und schüchtern ein Clavierüber den Flur.Der Himmel lastete wie Schiefer,ihr Spiel klang immer trauertiefer,ich sah sie wohl.Dumpf rang der Wind im Eschenlaub,die Luft war grau von Gluth und Staubund seufzte hohl.Und blasser tönten durch die Wändedie tastenden verweinten Hände —sie saß und sang;sang sich das Lied, in sich gebückt,mit dem sie mich als Braut entzückt;ich fühlte, wie ihr Athem rang.Die Wolken wurden immer dumpfer,die wunden Töne immer stumpfer,wie Messer stumpf, wie Messer spitz;und aus dem alten Liebesliedklagten zwei Kinderstimmen mit — —da fiel der erste Blitz.",l0060062,Es war einmal,"Dehmel, Richard",5,6,"Moderner Musen-Almanach auf das Jahr 1893, hrsg. von Otto Julius Bierbaum. München 1893.",b'1893',"Bierbaum, Otto Julius"
11,"Heut ging ich müßigDen langen Tag,Nun bitter büß' ichDen Mißertrag.UmhergetriebenIn Markt und Stadt,Und Nichts geblieben,Was Tiefe hat.Ein flaches TändelnMit der und der,Ein schwaches PendelnDie Kreuz und Quer.Ein BüchsenschießenUnd Budenschrei'n,Ein halb VerdrießenUnd Nichtsgedeih'n.Der Schwarm der GrillenSchwirrt stechend um,Mich einzuhüllenMit Summ und Brumm.""Was gingst du müßigDen langen Tag?""Und bitter büß' ichDen Mißertrag.",l0060030,Müßiggang,"Henckell, Karl",3,8,"Moderner Musen-Almanach auf das Jahr 1893, hrsg. von Otto Julius Bierbaum. München 1893.",b'1893',"Bierbaum, Otto Julius"
12,"Ich ging durch die dumpfige Großstadtgasse,Da trieben sich Menschen bunt wie das Vieh —Ich sage nicht, daß ich die Menschen hasse,Im Gegentheil: ich liebe sie.Ich schritt fürbaß. In endlosen ReihnStarrten Laternen müßig mich an —Da stieg mir jählings die Frage zu Hirn:Warum hängen da keine Menschen daran?— Die Pfähle sind doch solid genug?Und weiter ging ich. Da schäumte ein Fluß,Begossen von brennender Abendgluth —Und jählings stieg mir die Frage zu Hirn:Warum führt sie nicht blutige Leichen, die Fluth?— Färbt Menschenblut denn minder roth?Und als ich kam vor die Stadt hinaus,Da saßen viel Raben beim Düngerfraß—Und wieder stieg mir die Frage zu Hirn:Warum sitzen sie nicht auf Menschenaas?— Verdaun sie doch Menschenaas ebenso flott!Und heimwärts zog ich die Großstadtgasse,Da lag sie verlassen und menschenleer —Ich sage nicht, daß ich die Menschen hasse:Ich liebe sie täglich mehr und mehr.",l0060044,Liebes-Erklärung,"Scharf, Ludwig",5,4,"Moderner Musen-Almanach auf das Jahr 1893, hrsg. von Otto Julius Bierbaum. München 1893.",b'1893',"Bierbaum, Otto Julius"
13,Sie nimmts mit Schuld und ReueDas heißt: bei Ihm — genau;Dafür liebt Er die Treue —Das heißt: bei seiner Frau.,l0060119,Ideale Ehe,"Towska, Kory",1,4,"Moderner Musen-Almanach auf das Jahr 1893, hrsg. von Otto Julius Bierbaum. München 1893.",b'1893',"Bierbaum, Otto Julius"
14,"""Wir bringen die Kultur zu euch!""Drang man aus Wien in's Türkenreich:Und überall mit großer SchnelleErhoben sich im Land Bordelle.",l0060112,Sarajewo August 1892 [Epigramme],"Wohlmuth, Alois",1,4,"Moderner Musen-Almanach auf das Jahr 1893, hrsg. von Otto Julius Bierbaum. München 1893.",b'1893',"Bierbaum, Otto Julius"
15,"Doch: ich hob nicht die Hand zum Stoße,Ich weinte still nur eine Nacht;Dann aber fing ich an zu lachen,Und lachte, bis ich's durchgelacht!Und stieß die Fackel in die Trümmer;Hei, wie das aufschlug! tollen Brand's!Und niederbarst die letzte SäuleIn lohewildem Flammentanz.Dann ging ich ruhig von der StätteUnd schritt hinein in's Dämmergrau'nUnd ließ des Morgens heit're Sonne,Den Nachtfrost mir vom Herzen thau'n.Nun steh' ich frei im freien Leben,Und aus dem Jüngling ward ein Mann,Und weitab liegt in Nacht und NebelWas seine Jugend hielt im Bann.",l0060087,Ein Jugend-Golgatha,"Flaischlen, Cäsar [Flaischlen, Caesar]",4,4,"Moderner Musen-Almanach auf das Jahr 1893, hrsg. von Otto Julius Bierbaum. München 1893.",b'1893',"Bierbaum, Otto Julius"
16,"Jüngst, lässig-heiter schlendernd in dem Glaspalast,Wo unsrer lieben Kunst- und Bierstadt München sichAlljährlich prunkend zeigt die stumme GötterschaarUnd das Gesindel dieser überlauten Zeit —Auf grober Malerleinwand nur, versteht sich, Freund —Ward ich von einem seltsam schönen Traum beglückt.Heiß war der Sommertag und schwül. Ich nippe gernVon vollen Schönheitsbechern Schaumesperlen nur,Des alten Götterneides schweigend eingedenk. —So fand ich mich in einer kühlen Ecke baldVor einem Glase Schurlemurle. O gewißNur Schurlemurle war der Nektarfeuertrank.Und da — schon sank mein bildermüdes Auge zu —Wen sah ich da? Es war nicht Wahn, nicht Täuschung, nein!Den lachenden, den sieghaft schönen Heidengott,Den tief geheimnißvollen Dionys. Er rittAuf einem Fabelhengste aus dem Stalle Böcklin's,Mit glattem Fell. Gar stolz und wohlgenährt und glänzendUnd auch noch kunstbegabt schien mir das schöne Vieh:Sein schimmernd Wiehern klang vor mancher KlecksereiWie donnerpolterndes Gelächter, machtvoll selig.Doch noch vergnügter schien der schöne Gott mir selbst.Ein übermüthig Lächeln lag auf seinem Mund,So weich wie eines vollerblühten Weibes. Ja,So lächeln Dichter, wenn die Ruhmesglorie hellSie plötzlich übersonnt, in zager halber Scham. —Zu lustig, rief der junge Gott mir lachend zu,Was seid ihr Menschen doch ein drolliges Gezücht!Beim Hund! Kein Gott versteht die Allerbesten ganz.Du weißt, im Lauf der Zeiten ward ein bißchen ichGelehrt. Das schadet selbst uns hohen Göttern nicht.Ein Vorrecht haben wir ja stets: Persönlichkeit.Nun ja, da las ich jüngst das alte Märlein mirVom Apfelbiß in eurem Schlangenparadies,Davon ihr sehnsuchtskranken Narren immer träumt,Wenn ihr in jenen bittersüßen Apfel beißt.Hm, nach den hohen Göttern richt das Märlein nicht,Und euer Adam, welch' ein stumpfer Erdenkloß!Soll ich dir sagen, wie die Menschen wurden? Ja?In meiner tollsten Jugendgrazienflegelzeit —Ach, auch wir Götter treiben's in der Jugend toll —Als ich in jubelrasendem Triumphe zogUms lichtazurne, leuchtend schöne Mittelmeer,Da ruht' ich einst mit meinem trunkenen müden SchwarmAuf einer seligen Insel, wo ein LorbeerhainDen warmen Schatten warf auf einen Wiesenhang,Aus dessen leuchtend sattem, weichem FrühlingsgrünDie Blüthensterne weiß und purpurn lachten. RechtEin seliger Ruheort. — Es rauschte silbern daEin sonnenspiegelnd Brünnlein heilig kühle Fluth,Das trübe Aug' zu netzen mit dem Weihenaß,Wenn es vom steten Schau'n der Schönheit müde, müde.Und als am reinen Morgen ich, nach tiefem Schlaf,Erquickt von dannen zog, blieb mir ein Weib zurück,Das schwärmend sich am Tag zuvor zu müd gerast.Und sie beschlich ein kecker Faun. Es brannten hellAls ewige Liebesfackeln Ätna und Vesuv.Von diesem Paare stammt ihr Alle, Alle ab,Der Göttin Wesen und des Fauns seltsam vermischtIm unzufriednen Busen. Rassenkreuzung taugtIn seltenen Fällen nur, das glaube mir, Poet.Und ich als Gott genieße mir ein Schauspiel nun,Wie es die frohen Götter lieben, die ja stetsDas frechste Publikum des zweifelhaften Spiels,Das Welt geheißen. Ja, beim Hund, ihr Menschen seidEin spaßhaft unbegreiflich drolliges Geschlecht.Bald herrscht der Faun in euch, die schöne Göttin bald,Die einst in meinem übertollen Schwarm erfuhr,Auf welchem dunklen Grund die wahre Schönheit blüht.Und kommt der ewige Streit einmal zum StillestandIn euch — nun Katzenjammer nennt man, glaub' ich, das.Am Kater gingen die Olympier zu Grund,Und eure zahmen Dichter wissen gar zu wohl,Warum sie wachend träumen von dem dunklen Gott,Den diese Welt gebären müsse, — diese Welt! —Daß er als Tröstung lache jedem bangen Leid.Zum Lachen! Schaut er dämmernd nicht aus jedem Bild.Aus jedem Weib, dem noch ein spärlich Reizchen blüht?Und feiert er dem öden Schwelger nicht ein FestIn jedem schmucken Dirnlein, das nur ein SymbolDes ewig trunknen Frühlings, den ich liebe, ich?Doch wie gesagt, ein drollig Schauspiel seid ihr mir,Besonders wenn das Weib ihr giftig zeternd schmäht.Weißt du, woher der eitle Narrenschmerz euch stammt?Von eurem Guckenwollen hinter diese Welt.Ihr Esel! Euer grausam dunkler Lebensdrang,Der Stolz, die Freude, eure dumpfe Sehnsucht selbst,Sie ruhen licht auf grausig schwülem dunklen Grund.Freut euch an ihrem Spiel, an ihrem bunten ScheinUnd starrt nicht in die Dämmertiefen, Narrenpack,In dem der Faun wird mächtiger von Jahr zu Jahr,Auch wenn er sittsam geht im Feigenblätterschurz.So räsonnirte mir der Gott noch lange fort,Der Schöpfung Krone nörgelnd schmähend unverschämt.Die ewigen Götter thun nichts halb. Das ist bekannt. —Doch ich gerieth in einen hellen Heidenzorn.Du frecher Hanswurst, was suchst du in diesem Haus,Wo doch wahrhaftig das Genie nicht frech sonst tollt?Du Narr, glaub ich dich nicht, so existirst du nicht.(Das war ein feiner Trumpf!) — Werd lieber Pastor mirUnd predige die Lebensfreude, grob und fein,Den höhern Töchtern, von der ewigen Eva stammendUnd nicht von deinem liederlichen Bacchenweib.Noch vieles sagt' ich so in meinem Heidenzorn.Das Schimpfen ist ein reiner Götterhochgenuß.Doch leider störte mich ein Gardelieutenant,Der einer Frau von dreißig Jahren schneidig undÄsthetisch schimpfte auf die Freilichtmalerei,Die leider nicht die Allerhöchste Billigung fand.Ein großer Kenner war der stramme Mars wohl nicht,Obgleich er einst gezappelt in dem goldnen Netz,Das hinkend der Hephästos fein geschmiedet. ODu tiefer Sinn der alten Märenseligkeit!",l0060076,An Otto Julius Bierbaum,"Weigand, Wilhelm",1,113,"Moderner Musen-Almanach auf das Jahr 1893, hrsg. von Otto Julius Bierbaum. München 1893.",b'1893',"Bierbaum, Otto Julius"
17,"Am Abend zwischen Traum und Wachen,Ich dachte nicht grade an heilige Sachen,Vor mir der Nazarener stand.Die schönen Gottesaugen lagenAuf mir wie zwei freundliche Fragen.Hielt eine Blume in der Hand,Hochstengelig ein goldner SternLehnt' an der Schulter unserm Herrn,Wie frommer Maler EngelsgestaltenIhre Friedenspalmen halten:Eine Sonnenblume, voll erschlossen,Von einem lieblichen Licht umflossen,Hob sich von seinem blauen KleidAls ein glänzendes Geschmeid.So schwebte in einem Nebel zartVor mir die göttliche Gegenwart,Darauf ich holden Schreckens geblickt,Bis ich darüber eingenickt.Am Morgen nach gesundem SchlafStand mir der Sinn ins Feld hinaus,Wo ich auf eine Hütte traf,Ein leicht gezimmert hölzern Haus.Drum ragten als ein Schirm und Zaun,Als ein golden Gegitter anzuschaun,Hochsäulig aufgereiht beisammen,Sonnenblumen, zehn helle Flammen.Das war ein dichterlicher Platz,Wie nur am Wege hold verstecktEin Sonntagskind ihn einmal entdeckt.Ein Wässerlein lief mit süßem GeschwätzDurch eine schattige Wiese hin,Sonst war die Stille hier Königin.Ihr König, der Frieden, saß auf der BankUnd putzte seine Krone blank.So oft ich vom Häuschen vorüber geh,Ein blau Gewand ich vor mir seh.Geht nicht, steht nicht, schwebt vielmehrIn einiger Höhe vor mir her.Schöne Gottesaugen schlagenSich nach mir auf mit freundlichem Fragen,Und von der Schulter unserm HerrnNickt schwankend der goldne Blätterstern,Die Sonnenblume, voll erblüht,Von einem himmlischen Leuchten umglüht.War nie diesen Blumen recht gut gewesen,Schalt sie bäuerisch und gemein,Kamen mir vor wie Küchenbesen,Die gerne wollten Prinzessinnen sein.Aber so läßt, was wir verachtet,Eh's drüber getagt nur, oder genachtet,Oft plötzlich die schlichte Hülle sinkenUnd uns seine heimliche Schönheit trinken.Besonders Poeten kommen oftZu solchen Gnaden unverhofft.",l0060015,Sonnenblumen,"Falke, Gustav",4,10,"Moderner Musen-Almanach auf das Jahr 1893, hrsg. von Otto Julius Bierbaum. München 1893.",b'1893',"Bierbaum, Otto Julius"
18,"Aus deinen grauen Augen droht,mir so vertraut,wie ein erstarrter Klagelautmit bleichen Zügen ein Verbot;ich weiß, auch du... Du warst einst Braut.Das hat in deinen Blick gebrachtdies fahle Licht,das durch die schwarzen Wimpern bricht;mir ist, als sahst du einst die Nachtvon Angesicht zu Angesicht.O komm und gieb mir deine Hand;in dein schwarz Haarnimm diese rote Lilie dar,und um dein dunkelblau Gewanddies goldne Gürtelschlangenpaar.So führe mich, indeß du weinst,den langen Pfad.So kommen wir der Nacht genahtund beten beide: Mutter! einst —wir übten Beide schon Verrath!Dann legt, indeß wir niederknien,dann legt die Nachtauf deines Haares schwere Prachtdie Hand — und flüstert: Liebe ihn,der sich und Andre friedlos macht!Dann hören deine Thränen auf,dann kommt ein Stern;der winkt so neu, so neu, so fern,dein graues Auge schaut hinauf,dein dunkles Auge... Sinke, Stern!",l0060060,Büßende Liebe,"Dehmel, Richard",6,5,"Moderner Musen-Almanach auf das Jahr 1893, hrsg. von Otto Julius Bierbaum. München 1893.",b'1893',"Bierbaum, Otto Julius"
19,"Du nächtig todeskranker Monddort auf des Himmels schwarzem Pfühl,Dein Blick, so fiebernd übergroß,bannt mich wie fremde Melodie.An unstillbarem Liebesleidstirbst du, an Sehnsucht, tief erstickt.Du nächtig todeskranker Monddort auf des Himmels schwarzem Pfühl. —Den Liebsten, der, im Sinnenrauschgedankenlos, zur Liebsten schleicht,belustigt deiner Strahlen Spiel —dein bleiches, qualgebornes Blut,du nächtig todeskranker Mond.",l0060127,"Der kranke Mond [Aus ""Pierrot lunaire""]","Hartleben, Otto Erich [alt. Hartleben, O. Erich; Hartleben, Erich] [Orig. von Giraud, Albert]",3,5,"Moderner Musen-Almanach auf das Jahr 1893, hrsg. von Otto Julius Bierbaum. München 1893.",b'1893',"Bierbaum, Otto Julius"
20,"Mondschein schimmert auf den Bergesspitzen,Zuckerreif ruht auf der Alpen Kranz.Ist ein Funkeln, Blitzen — —Alles eitel Schnee und Glanz!Tannenschatten liegt am Fuß des Eigers,Doch sein Sattel badet sich in Licht;Hoch vom Haupt des SchweigersHell der Quell des Glanzes bricht.Hollah Leben! — Rosenrothe Glieder!!Keck im Sattel, zart auf Firnenflaum,Vorn ein Büschel Flieder,Locken schüttelnd in den Mondenschaum — —Reitet nackt ein übermüth'ger Knabe,Reckt in's Mondlicht sein Champagnerglas,Schüttet aus als GabeTropfenhell ein goldig Naß.Rosa-crême — — im Mondlicht schäumt es leise,Sickert nieder an des Eigers Wand;Von dem FliederreiseSprüht ein Leuchten in das Land.Hollah Leben! Die ChampagnertropfenZischen mondhell in den weißen Schnee.Herz, mein Herz, dein KlopfenKündet, daß ich Schönheit seh'!",l0060089,Eiger-Reiter,"Stern, Maurice Reinhold von [Stern, Maurice von; alt. Stern, Maurice-Reinhold von]",6,4,"Moderner Musen-Almanach auf das Jahr 1893, hrsg. von Otto Julius Bierbaum. München 1893.",b'1893',"Bierbaum, Otto Julius"
