,text,ID,Titel,Autor,Strophen,Verse,Anthologie,Jahr,Hrsg
234,"Ach scheiden, immer scheiden!Wer hat denn das erdacht?Der hat in meine FreudenEin großes Trauern bracht.Du Wächter auf der Zinnen!Ruf du den Tag nicht an,Daß ich nicht muß von hinnen,Ein Ringlein sollst du han.""Und will ich stille bleiben,Die Sonne kommt geschwind;Die wird zwei Lieb vertreiben,Die gern beisammen sind.""Ach scheiden, immer scheiden!Wer hat denn das erdacht?Der hat in meine FreudenEin großes Trauern bracht.",l0090166,Vom Scheiden,"Pfau, Ludwig",4,4,Neue Lieder der besten neueren Dichter für's Volk. Zusammengestellt v. Dr. L. Jacobowski. Berlin 1899.,b'1899',"Jacobowski, Ludwig [alt. Jakobowsky, Ludwig]"
235,"Noch ist der Himmel schwarz verhängt,Geschlossen sind noch alle Fenster,Und um die Dächer leise gehnNoch immer schwarze Nachtgespenstcr.Da plötzlich knarrt ein Scheunentor,Entsetzt die Geister seitwärts springen.Aus den Türen treten Bauern vor,Die in den Händen Dreschflegel schwingen.Nun klappert's in der Scheune drin,Und klopft es Schlag um Schlag,Das dringt zum Himmelsfenster hin:Wach auf! wach auf, du junger Tag!Das klappert und klopft so laut, so laut,Schnell zieht der Tag die Kleider an;Natürlich, da hängt noch der gestrige Dreck.Er bürstet, was er bürsten kann.Streicht aus der Stirn die Haare fort,Streckt aus dem Himmel sein rot Gesicht,Das klappert und klopft in einem fort,Stock her! schreit er, dann helpt dat nicht.",l0090271,Tagesanbruch auf dem Lande,"Aram, Kurt",5,4,Neue Lieder der besten neueren Dichter für's Volk. Zusammengestellt v. Dr. L. Jacobowski. Berlin 1899.,b'1899',"Jacobowski, Ludwig [alt. Jakobowsky, Ludwig]"
236,"Klopf! Klopf!Ich hocke hier auf dem GranitDen lieben langen Tag,Und springt der Stein, ich zucke mitBei jedem Hammerschlag.Es fliegt der Staub in meine BrustUnd nagt sie langsam ab.Ich klopfe, ich klopfe,Ich klopfe mich ins Grab.Klopf! Klopf!Was gehen für Leute nur vorbei!Ein Herrlein steht und lauscht.Nickt mir, daß ich so fleißig sei,Lauscht, wie die Mosel rauscht.Ich zieh' vergebens meinen Bart,Wer dem die Zeit wohl gab,Und klopfe und klopfe,Ich klopfe mich ins Grab.Klopf! Klopf!Ich liebe eine NäherinDa unten in der Stadt.So innig gibt sie sich mir hin,Ist auch so blond und matt.Ich mache sie zu meinem Weib,Ich will auch Heim und Hab!Und klopfe und klopfeUnd klopfe mich ins Grab.",l0090020,Der Steinhauer,"Bodman, Emanuel von [alt. Bodmann, Emanuel von; Bodman, Emanuel Freiherr von]",3,9,Neue Lieder der besten neueren Dichter für's Volk. Zusammengestellt v. Dr. L. Jacobowski. Berlin 1899.,b'1899',"Jacobowski, Ludwig [alt. Jakobowsky, Ludwig]"
237,"Auf der Bank im WaldeHan sich gestern zwei geküßt.Heute kommt die NachtigallUnd holt sich, was geblieben ist.Das Mädchen hat beim ScheidenDie Zöpfe neu sich aufgesteckt...Ei, wieviel blonde Seide daDie Nachtigall entdeckt!Den Schnabel voller Fäden,Kehrt Nachtigall nach Haus,Und legt das zarte NestchenMit ihrem Golde aus.Freund Nachtigall, Freund Nachtigall,So bleib's in allen Jahren! —Mir ward ein Schnäblein voll Gesang,Dir eins voll Liebchens Haaren!",l0090158,Anmutiger Vertrag,"Morgenstern, Christian",4,4,Neue Lieder der besten neueren Dichter für's Volk. Zusammengestellt v. Dr. L. Jacobowski. Berlin 1899.,b'1899',"Jacobowski, Ludwig [alt. Jakobowsky, Ludwig]"
238,"O Mutter! was hab ich getan,Der Ring ist Schuld daran:Mein Lieb hat ihn vergeben,Das kostet mich das Leben;Einem Hauptmann gab sie ihn.Ich ging und ward Soldat,Das reute mich zu spat.Wollt' mir den Urlaub holenMit meinen flinken Sohlen,Den Urlaub ins freie Feld.Mein Hauptmann vor mich trat:""Wohin des Wegs, Kamerad?""Hält vor die blanke Klinge,Hat an der Hand viel Ringe —Dabei meiner Liebsten Ring.Die Sonne schien so hell,In einen klaren Quell.Wohl auf der grünen Heide,Da warf ich weg die ScheideWeg warf ich das Kollett.Und gab ihm Schlag auf Schlag,So viel er parieren mag.Da kam in den klaren BronnenDas rote Blut geronnen —Das war des Hauptmanns sein Blut.Ade du schöne Welt!Mein Urteil ist gefällt:Der Hauptmann ist erschlagen,Ich leb'; doch in drei TagenErschossen muß ich sein.Und wer da weint und lad't,Das ist mein Kamerad;Er führt mich unter die Linden.Tut mir die Augen verbindenMit seinem Taschentuch.Soldaten! und ist's vorbei,Vollbracht mit Pulver und Blei,So legt in ein weißes LinnenMein Herz mit den Kugeln drinnenUnd bringet's meinem Schatz.Ihr Brüder! was ich euch bitt':Sagt's meiner Mutter nit;Das ist mein letztes Verlangen —Sagt lieber, ich sei gefangen,Sie säh mich nimmermehr.",l0090167,Der verschenkte Treuring,"Pfau, Ludwig",9,5,Neue Lieder der besten neueren Dichter für's Volk. Zusammengestellt v. Dr. L. Jacobowski. Berlin 1899.,b'1899',"Jacobowski, Ludwig [alt. Jakobowsky, Ludwig]"
239,"Ob ihm mein Bild erscheinenNoch manchmal mag im Traum,Wenn schlaflos ich vom WeinenLieg' nachts auf weichem Flaum?Die Myrthe, die er brachte,Und die ich fort und fortGepflegt und treu bewachte,Ist lange schon verdorrt.Auch hat man mir's verkündet,Daß er im fernen LandEin neues Heim gegründet,Dort längst die Gattin fand.Seitdem er mich verlassen,Schon manches Jahr verran,Und doch! ich kann's nicht fassen,Denk' ich aufs neu' daran.Und spricht wer auf dem Gange,Wähn' ich, er nahe sich;Ich Törin, die doch langeWeiß, daß er tot für mich.Nun klingt's wie GrabesläutenMir oft im Abendrot,Gewiß, das soll bedeuten,Es ruft nach mir der Tod.Und dennoch kann ich wehrenDem eitlen Herzen nicht,Er müsse wiederkehrenEs stets von neuem spricht.Wie oft, wenn nachts vernommenGedämpften Schritt mein Ohr,Mein' ich, er sei gekommenUnd harr' wie sonst am Tor.Von hinnen muß ich gehenUnd folg' dem Rufe gern.Nur einmal möcht' ich sehenSein Weib und ihn von fern.Seh'n glücklich, eh' ich scheide,Den, dem ich längst verzieh,Und ist er's, segnen beideIm Herzen ihn und sie.",l0090247,Das verlassene Mädchen,"Walling, Günther",10,4,Neue Lieder der besten neueren Dichter für's Volk. Zusammengestellt v. Dr. L. Jacobowski. Berlin 1899.,b'1899',"Jacobowski, Ludwig [alt. Jakobowsky, Ludwig]"
240,"Horch, Kind, horch, wie der Sturmwind wehtUnd rüttelt am Erker!Wenn der Braunschweiger draußen steht,Der faßt uns noch stärker.Lerne beten, Kind, und falten fein die Händ',Damit Gott den tollen Christian von uns wend'!Schlaf, Kind, schlaf, es ist Schlafens-Zeit,Ist Zeit auch zum Sterben.Bist du groß, wird dich weit und breitDie Trommel anwerben.Lauf ihr nach, mein Kind, hör' deiner Mutter Rat:Fällst du in der Schlacht, so würgt dich kein Soldat.""Herr Soldat, tut mir nichts zu leidUnd laßt mir mein Leben!""""Herzog Christian führt uns zum Streit,Kann kein Pardon geben.Lassen muß der Bauer mir sein Gut und Hab',Zahle nicht mit Geld, nur mit dem kühlen Grab.""Schlaf, Kind, schlaf, werde stark und groß;Die Jahre, sie rollen.Folgst bald selber auf stolzem RoßHerzog Christian, dem Tollen.Wie erschrickt der Pfaff und wirft sich auf die Knie —""Für den Bauer nicht Pardon, den Pfaffen aber nie!""Still, Kind, still, wenn Herr Christian kommt,Der lehrt dich zu schweigen!Sei fein still, bis dir selber frommt,Ein Roß zu besteigen.Sei fein still, dann bringt der Vater bald dir Brot,Wenn nach Rauch der Wind nicht sckmeckt und nicht der Himmel rot.",l0090109,Aus dem dreißigjährigen Kriege,"Huch, Ricarda",5,6,Neue Lieder der besten neueren Dichter für's Volk. Zusammengestellt v. Dr. L. Jacobowski. Berlin 1899.,b'1899',"Jacobowski, Ludwig [alt. Jakobowsky, Ludwig]"
241,"Ich ging übers Heidemoor allein,Da hört ich zwei Raben kreischen und schrein;Der eine rief dem anderen zu:""""Wo machen wir Mittag, ich und du?""""""Im Walde drüben liegt unbewachtEin erschlagener Ritter seit heute Nacht,Und niemand sah ihn in Waldesgrund,Als sein Lieb und sein Falke und sein Hund.Sein Hund auf neuer Fährte geht,Sein Falk auf frische Beute späht,Sein Lieb ist mit ihrem Buhlen fort, —Wir können speisen in Ruhe dort.Du setzest auf seinen Nacken dich,Seine blauen Augen sind für mich,Eine goldene Locke aus seinem HaarSoll wärmen das Nest uns nächstes Jahr.Manch einer wird sprechen: ""Ich hatt' ihn lieb!""Doch keiner wird wissen, wo er blieb,Und hingehen über sein bleich GebeinWird Wind und Regen und Sonnenschein.""",l0090072,Die zwei Raben,"Fontane, Theodor",5,4,Neue Lieder der besten neueren Dichter für's Volk. Zusammengestellt v. Dr. L. Jacobowski. Berlin 1899.,b'1899',"Jacobowski, Ludwig [alt. Jakobowsky, Ludwig]"
242,"Abendstille, weich und warm,Kaum ein Hauch zu spüren,Stehn die Mädchen Arm in ArmPlaudernd vor den Türen.Fliegt das Mäulchen noch so spätOhne Ziel und Maßen,Horchen, wie der Wagen gehtDurch die stillen Straßen.Kläfft der Spitz den Rädern zu,Die gemach entschwinden,Süße, sanfte SommerruhSinkt ins Laub der Linden.Nur ein ferner BurschensangTönt noch hin und wieder,Seelchen lauscht dem HeimatklangAlt gewohnter Lieder.Zieht zur lieben SommerzeitStill verträumte Bahnen,Ach, du wanderst viel zu weit,Seelchen, laß dich mahnen.",l0090279,Abendstille,"Busse, Carl [alt. Busse, Karl]",5,4,Neue Lieder der besten neueren Dichter für's Volk. Zusammengestellt v. Dr. L. Jacobowski. Berlin 1899.,b'1899',"Jacobowski, Ludwig [alt. Jakobowsky, Ludwig]"
243,"Es haben alle StändeSo ihren Degenwert,Und selbst in SchneiderhändeKam einst das Heldenschwert;Drum jeden, der da zünftigMit Nadel und mit Scher',Der mache jetzt und künftigVor Derffling sein Honneur.In seinen jungen TagenWar das ein Schneiderblut,Doch mocht ihm nicht behagenSo Zwirn wie Fingerhut,Und wenn er als GeselleSo saß und fädelt ein,Schien ihm die SchneiderhölleDie Hölle selbst zu sein.Einst, als das NadelhaltenIhm schier ans Leben ging,Dacht' er: ""Das SchädelspaltenIst doch ein ander Ding.""Fort warf er Maß und ElleVoll Kriegslust an die WandUnd nahm an Nadels StelleDen Säbel in die Hand.Sonst focht er still und friedlichNach Handwerksburschen-Recht,Jetzt war er unermüdlichBeim Fechten im Gefecht;Es war der flinke SchneiderZum Stechen wohl geschickt,Oft hat er an die KleiderDem Feinde was geflickt.Er stieg zu hohen Ehren,Feldmarschall ward er gar,Es mocht' ihn wenig kehren,Daß einst er Schneider war;Nur fand er einen Spötter,Verstund er keinen SpaßUnd brummte: ""Für HundsfötterIst hier mein Ellenmaß.""Krank lag in seinem SchloßeDer greise Feldmarschall,Keins seiner LieblingsrosseKam wiehernd aus dem Stall;Er sprach: ""Als alter SchneiderWeiß ich seit langer Zeit,Man wechselt seine Kleider, —Auch hab ich des nicht leid.""Es fehlt der alten HülleIn Breite schon und Läng',Der Geist tritt in die Fülle,Der Leib wird ihm zu eng;Gesegnet sei dein Wille,Herr Gott, in letzter Not!""Er sprach's und wurde stille, —Der alte Held war tot.",l0090073,Der alte Derffling,"Fontane, Theodor",7,8,Neue Lieder der besten neueren Dichter für's Volk. Zusammengestellt v. Dr. L. Jacobowski. Berlin 1899.,b'1899',"Jacobowski, Ludwig [alt. Jakobowsky, Ludwig]"
244,"Beim Schäferhaus am grünen Rain,Da lag ich einmal, saß und lag,Da war wie nirgend Sonnenschein,Ein Leuchten, wie an keinem Tag.Des Weges kam ein kleiner Fuß,Das schönste Kind vom Dorfe kam,Wir beide boten uns den Gruß,Den jedes gab und jedes nahm.Das war im Duft und Sonnenschein!Und wenn ich nun vorübergeh'Beim Schäferhaus am grünen Rain,Ist's mir wie ewig wohl und weh.Und wer das alles wollt versteh'n,Am schönsten Tag und Sonnenschein,Da müßt ihm so wie mir gescheh'nBeim Schäferhaus am grünen Rain.",l0090061,Beim Schäferhaus,"Fischer, J.G. [alt. Fischer, Johann Georg]",4,4,Neue Lieder der besten neueren Dichter für's Volk. Zusammengestellt v. Dr. L. Jacobowski. Berlin 1899.,b'1899',"Jacobowski, Ludwig [alt. Jakobowsky, Ludwig]"
245,"Als der Herr in GethsemaneAuf Knien lag im schwersten Weh,Als er sich hob, nach den Jüngern zu schauen,Lies er die Tränen niedertauen:Er fand sie schlafend, und mit den GenossenHatte selbst Petrus die Augen geschlossen.Zum zweiten Mal sucht er die Seinen dann,Die liegen noch immer in Traumes Bann.Und zum Dritten, allein im Schmerz,Zeigt er Gott das kämpfende Herz.Die heilige Stirn wird ihm feucht und naß,""Mein Vater, ist es möglich, daß...""Und durch ein GartenmauerlochSchlüpft' ein zottig Hündchen und krochDem Heiland zu Füßen und schmiegt' sich ihm an,Als ob es ihm helfen will und kann.Und der Herr hat mild lächelnd den Trost gespürt,Und er nimmt's und drängt's an die Brust gerührtUnd muß es mit seiner Liebe umfassen,Die Menschen hatten ihn verlassen.",l0090142,Legende,"Liliencron, Detlev von [Liliencron, Detlev Freiherr von; alt. Liliencron, Detlev Frhr. von]",1,20,Neue Lieder der besten neueren Dichter für's Volk. Zusammengestellt v. Dr. L. Jacobowski. Berlin 1899.,b'1899',"Jacobowski, Ludwig [alt. Jakobowsky, Ludwig]"
246,"Jeden Abend um diese ZeitZieh' ich an ein lila Kleid,Gelbe Strümpfe, lila Schuh,Ach, mein Spiegel allein sieht zu.Backen und Lippen färb' ich rot,Und nun tanz ich auf Leben und Tod.Wenn in den Jubel der Vorhang fällt,Bin ich die Königin der Welt.Aber morgens um diese ZeitZieh' ich an ein graues Kleid,Und ich habe dann oft die NachtTief in Tränen zugebracht.Seit er mich verlassen hat,Irr' ich so von Stadt zu Stadt,Und das goldene SonnenlichtLeuchtet auf ein blass' Gesicht.Aber abends um diese ZeitTrage ich mein lila Kleid,Lach' ich im erhellten HausAlle die Männerblicke aus,Schwenk' ich wie keine mein schönes BeinIn den Menschenraum hinein,Glühen meine Lippen rot,Tanz' ich über Leben und Tod.",l0090019,Die Tänzerin,"Bodman, Emanuel von [alt. Bodmann, Emanuel von; Bodman, Emanuel Freiherr von]",3,8,Neue Lieder der besten neueren Dichter für's Volk. Zusammengestellt v. Dr. L. Jacobowski. Berlin 1899.,b'1899',"Jacobowski, Ludwig [alt. Jakobowsky, Ludwig]"
247,"Schlaf, mein Küken, — Racker, schlafe!Guck: im Spiegel stehn zwei Schafe,Bläkt ein großes, mäht ein kleines,Und das kleine, das ist meines!Bengel, Bengel, brülle nicht,Du verdammter Strampelwicht.Still, mein süßes Engelsfüllen:Morgen schneet es Zuckerpillen,Übermorgen blanke Dreier,Nächste Woche goldne Eier,Und der liebe Gott, der lacht,Daß der ganze Himmel kracht.Und du kommst und nimmst die Spenden,Säst sie aus mit Sonntagshänden,Und die Erde blüht von Farben,Und die Menschen tun's in Garben. —Herr, den Bengel kümmert nischt,Was man auch für Lügen drischt.Warte nur, du Satansrachen:Heute Nacht, du kleiner Drachen,Durch den roten HöllenbogenKommt ein Schmetterling geflogen,Husch dir auf die Nase, hu,Deckt dir beide Augen zu:Deckt die Flügel sacht zusammen,Daß du träumst von stillen Flammen,Von zwei Flammen, die sich fanden,Hölle, Himmel still verbanden. —So, nun schläft er; es gelang;Himmel, Hölle, Gott sei Dank.",l0090039,Wiegenlied für meinen Jungen,"Dehmel, Richard",5,6,Neue Lieder der besten neueren Dichter für's Volk. Zusammengestellt v. Dr. L. Jacobowski. Berlin 1899.,b'1899',"Jacobowski, Ludwig [alt. Jakobowsky, Ludwig]"
248,"Das Heimchen zirpt im kalten Herd,Der Herbstwind durch die Bäume fährt;Die Nächte sind so lang, so lang,Mir ist ums Herz so bang, so bang:Ich sitz' allein und spinneUnd sinne, sinne.Die Rat und linden Trost mir gab,Die Mutter, schläft im kühlen Grab;Der Vater ist wohl gut, doch rauh,Sein Mut ist trüb, sein Haar ist grau,Er weiß nicht, was ich meine,Wenn ich still weine.Und einer, der einst hold mir war,Nun ist er fort ins vierte Jahr.Wie ihm das Schweifen nur gefällt?So falsch ist doch die fremde Welt!Wollt' er mein Leid bedenken,Es müßt ihn kränken.Vergaß er mich? O Not und Pein,Die Sünde mag ihm Gott verzeihn!Die fremde Welt ist falsch und klug.O spänn' ich nur mein Leichentuch!Ich muß des Flachses FadenMit Tränen baden. —Durchs Dorf im Grund der Wächter geht;Schwarz ragt der Wald, es ist schon spät.Die Lampe lechzt und flimmert kaum,Das Heimchen zirpt noch leis' im Traum:Mich flieht der Schlaf, ich spinneUnd sinne, sinne.",l0090256,Gretleins Trauer,"Weber, Friedrich Wilhelm [Weber, F. W.]",5,6,Neue Lieder der besten neueren Dichter für's Volk. Zusammengestellt v. Dr. L. Jacobowski. Berlin 1899.,b'1899',"Jacobowski, Ludwig [alt. Jakobowsky, Ludwig]"
249,"Überall kann ich dich sehen,Trennt uns gleich auch Raum und Zeit,Immer fühl' ich um mich wehenDeine sanfte Lieblichkeit.Und ein Zauber ohne EndeLebt und webt von mir zu dir —Deinen Mund und deine Hände,Deine Seele gibst du mir!",l0090150,An die Geliebte,"Lorenz, Felix",2,4,Neue Lieder der besten neueren Dichter für's Volk. Zusammengestellt v. Dr. L. Jacobowski. Berlin 1899.,b'1899',"Jacobowski, Ludwig [alt. Jakobowsky, Ludwig]"
250,"Es weht der Wind so kühle,Die Bahn ist arg verschneit;Ich bin daheim am Bühle,Da ist der Weg so weit.Mein Haus hat keinen Riegel,Mein First hat keinen Halt,Mein Dach hat keinen Ziegel,Mein Stüblein ist so kalt.Mein Lieb, daß dich's erbarme!O laß mich zu dir ein!Schließ mich in deine Arme,Da wird kein Winter sein.",l0090168,Die Liebste,"Pfau, Ludwig",3,4,Neue Lieder der besten neueren Dichter für's Volk. Zusammengestellt v. Dr. L. Jacobowski. Berlin 1899.,b'1899',"Jacobowski, Ludwig [alt. Jakobowsky, Ludwig]"
251,"Nichts Süßeres auf ErdenAls treu in Liebe steh'n,Trotz Not und trotz BeschwerdenNicht voneinander gehn.Wie sich das Wetter wende,Die Treu' hält allzeit Stand.Was auch das Schicksal sende,Die Lieb' nimmt's in die Hand.Ob Frühling oder Winter,Ob Dämmerung, Morgenrot,Und wartet still dahinterDer ernste Schnitter Tod.Nichts Süßeres auf Erden,Als treu in Liebe steh'n,Und soll's der Abschied werden:Ade! Auf Wiedersehn!",l0090031,Bekenntnis,"Conrad, Michael Georg",4,4,Neue Lieder der besten neueren Dichter für's Volk. Zusammengestellt v. Dr. L. Jacobowski. Berlin 1899.,b'1899',"Jacobowski, Ludwig [alt. Jakobowsky, Ludwig]"
252,"Das war um des fünften Heinrich Zeit,Der brach dem Bischof von Straßburg den Eid.""Und wer mir Clemens als Papst nicht erkennt,Den treffe in Rache, was sticht und brennt.""Und er raubte in Ruffach das Bistum und SchloßUnd er stürmte die Stadt mit Heer und Roß.Herr Vogt, geht hin, zeigt eiserne Hand,Bis sie Clemens als Herren von Rom erkannt!Der Vogt übte Willkür mit Wut und Graus —Das Glück schlich weinend zum Tor hinaus...Einst blaute ein schimmernder Ostertag,Da glimmten die Blüten wie Kerzen am Hag;Da stieg es wie Weihrauch vom Blumengefild,Vom Kirchlein sangen viel Stimmen mild —Und ängstlich huschten die Bürger hinein,Als könnt wer die heilige Schwelle entweihn.Grad fällt ein Goldstrahl ins Kirchentor,Da wandelt ein herrliches Mädchen hervor.So rein ist die Stirn und so scheu ihr TrittDa trotzt ihr entgegen ein eherner Schritt.Es bricht sich der eiserne Vogt die Bahn:""Euch hat der Kaiser in Acht getan;Ihr alle seid mir zu eigen und Frohn.Ich such meiner Lust den süßesten Lohn.""Zwei Knechte schleppen die Maid hinweg;Da tritt in die Reihen der fahle Schreck.Und die Mutter sinkt flehend zur Erde hin:""Auf, Männer! Macht eisern die Faust und den Sinn!Wenn der Kaiser und Vogt unser Heiligstes zwingtUnd die Freiheit mit Wildheit niederringt,Dann ist's Zeit, daß das Gräßliche, was sie gesät,Das Schwert der Verzweiflung niedermäht...""Die Männer schaun wie verwirrt und gebannt,Und keiner regt zu Taten die Hand.Da erhebt sich die Mutter in höchster Not,Ihr Wort klingt gewaltig wie ein Gebot:""Und knebelt er eure Männerkraft,So ruf' ich ein Höheres aus der Haft,Ihr Frauen, aus eures Herzens GlutErweck' ich der Mutter heiligen Mut!Wem warmes Blut in den Adern rinnt,Der eile zum Kampf für ein schuldloses Kind!""Da fahren sie stolz wie Löwinnen auf —Sie entreißen den Männern der Schwerter Knauf,Und die Entflammten wachsen zum HeerUnd greifen in heiliger Wut zum Speer —Und wie sie den Bergpfad stürmen hindann,Da fällt's von den Männern wie dumpfer Bann.Die Ruffacher strecken mit Hieb und StichDen Vogt und alles was kaiserlich...Und Heinrich der Fünfte enteilt zu RoßNach Kolmar mit seinem zerschmolzenen Troß...Die Sage kündet: Der Kaiser vergaßDie Krone, und ward gar schreckensblaß;Und Mantel und Szepter fand er nicht mehr,Noch fürstlich Gewaffen und Manneswehr.Doch die siegenden Frauen haben zur NachtNoch Krone und Szepter zum Kirchlein gebracht;Und den Mantel, purpurdunkel und fein,Den hüllten sie um den Altarschrein...Wenn die Liebe im Frauenherzen erwacht,So loht sie empor zu reinerer Macht,Als Mannesmut und Herrschergewalt,Und alles Schöne in freier Gestalt;So wird sie in heiliger LeidenschaftDes Weltrundes tiefinnerste Kraft.",l0090176,Die Frauen von Ruffach,"Puttkamer, Alberta von [alt. Puttkammer, Alberta von; Puttkamer, Alberta Freiin von]",1,66,Neue Lieder der besten neueren Dichter für's Volk. Zusammengestellt v. Dr. L. Jacobowski. Berlin 1899.,b'1899',"Jacobowski, Ludwig [alt. Jakobowsky, Ludwig]"
253,"Schau diese Welt, an Wundern reich,Und alle nur sich selber gleich,Es möchte im weiten SonnenscheinKein Blatt noch Blütlein anders sein,Denn was aus Zweig und Knospe kam,Ist schön genug und wundersam;Doch mein Triumph und Jauchzen ist,Daß du nicht eine andere bist,Daß ich, du liebe Gottesgabe,Aus aller Welt dich funden habe.",l0090053,Gottesgabe,"Fischer, J.G. [alt. Fischer, Johann Georg]",1,10,Neue Lieder der besten neueren Dichter für's Volk. Zusammengestellt v. Dr. L. Jacobowski. Berlin 1899.,b'1899',"Jacobowski, Ludwig [alt. Jakobowsky, Ludwig]"
254,"Alle Mädchen erwarten wen,Wenn die Bäume in Blüten stehn;Wir müssen immer nähn und nähn,Bis uns die Augen brennen.Unser Singen wird nimmer froh,Fürchten uns vor dem Frühling so:Finden wir einmal ihn irgendwo,Wird er uns nicht mehr erkennen.",l0090186,Die Näherin,"Rilke, Rainer Maria [alt. Rilke, Rainer-Maria]",2,4,Neue Lieder der besten neueren Dichter für's Volk. Zusammengestellt v. Dr. L. Jacobowski. Berlin 1899.,b'1899',"Jacobowski, Ludwig [alt. Jakobowsky, Ludwig]"
255,"Das Herz ist mir so schwer, so schwer!Ich wollt', daß ich zu Hause wär';Da steh ich auf im MorgenscheinUnd wandre fort, landaus, landein,Zur Herzallerliebsten mein.Da komm' ich heim in stiller NachtUnd klopfe an ihr Lädlein sacht,Und klopfe an ihr Fensterlein:Mach auf, mach auf und laß mich ein,Du Herzallerliebste mein!Da schaut ein altes Weib heraus —:""Dein Schätzlein zog zum Ort hinaus,Im letzten Haus, da zog sie ein,Da wohnt hinter Rosen und RosmareinDie Herzallerliebste Dein.""Da geh' ich weiter für und für,Da komm' ich an die Kirchhoftür:O weh, o weh! der Totenschrein,Der wird das letzte Haus wohl sein,Du Herzallerliebste mein!Ach! daß du liegst im tiefen Grund!Hörst nicht des Glöckleins Schlag allstund,Siehst weder Sonn' noch Mondenschein,Schläfst da so mutterseelenallein,Du Herzallerliebste mein!",l0090165,Im letzten Haus,"Pfau, Ludwig",5,5,Neue Lieder der besten neueren Dichter für's Volk. Zusammengestellt v. Dr. L. Jacobowski. Berlin 1899.,b'1899',"Jacobowski, Ludwig [alt. Jakobowsky, Ludwig]"
256,"Stehn vor den Leuten wir,Sprichst du kein Wort zu mir,Bleibst ach so stolz und fernUnd hast mich doch so gern —Ganz im Geheimen.Kommst du doch jede NachtZu mir im Traum, und sachtSchlingst deinen Arm um mich,Und ich, ich küsse dich —Ganz im Geheimen.Wenn's auch ein Traum nur ist,Daß du mein Liebchen bist,Bleib nur im Traume mein,Und ich will selig sein —Ganz im Geheimen.",l0090125,Ganz im Geheimen,"Königsbrunn-Schaup, Franz von [Königsbrun-Schaup; Königsbrunn-Schaup]",3,5,Neue Lieder der besten neueren Dichter für's Volk. Zusammengestellt v. Dr. L. Jacobowski. Berlin 1899.,b'1899',"Jacobowski, Ludwig [alt. Jakobowsky, Ludwig]"
257,"Vom Barette schwankt die Feder,Fliegt und wiegt im Winde sich,Unser Wams von BüffellederIst zerfetzt von Hieb und Stich.Stich und HiebUnd ein LiebSoll ein Landsknecht haben.Unsre Linke auf dem Schwerte,In der Rechten einen Spieß,Fechten wir, soweit die Erde,Bald für das und bald für dies.Dies und dasSuff und FraßSoll ein Landsknecht haben.Daß wir Beut' und Ruhm gewinnen,Ziehn wir mutig in die Schlacht.Einmal müssen wir von hinnen,Lustig drum bei Tag und Nacht.Bei Nacht und Tag,Was er mag,Soll ein Landsknecht haben.",l0090178,Landsknechtlied,"Reder, Heinrich von",3,7,Neue Lieder der besten neueren Dichter für's Volk. Zusammengestellt v. Dr. L. Jacobowski. Berlin 1899.,b'1899',"Jacobowski, Ludwig [alt. Jakobowsky, Ludwig]"
258,"Rot der Rock und das Mieder blau;Madai, du bist meine liebe Frau,Schau doch in Runde und Weite:Grün ist der Hafer, das Korn wie Gold,Hurrah, uns Zwei'n ist die Liebe hold,Madai, ich komme zur Freite.Madai, ich komm' mit dem Erntekranz,Madai, ich komme zum Hochzeitstanz,Hörst du den Finken schlagen?Komm, komm, komm in das goldene Korn,Hinten dort, hinter dem HeckendornWill ich ein Wort dir sagen.Nur ein Wort, o du Meine du,Nur ein Wort, mach' die Augen zu,Glaube mir blind, was ich schwöre.Horch, wie das Korn leis' rauscht im Rund,Horch, es segnet unsern Bund,Daß ich dir ganz gehöre.",l0090014,Schwur im Korn,"Bierbaum, Otto Julius",9,1,Neue Lieder der besten neueren Dichter für's Volk. Zusammengestellt v. Dr. L. Jacobowski. Berlin 1899.,b'1899',"Jacobowski, Ludwig [alt. Jakobowsky, Ludwig]"
259,"Wenn mein Weg in dunklen TagenSich durch Stein und Dornen windet,In der Wildnis ganz verschwindet,Auch zur Nacht kein Ende findet —Nun wohlan! ich muß es tragen.Wenn mich üble Feinde plagen,Ungedenk des Richters drobenWider kleine Fehler toben,Herbe Tüchtigkeit nicht loben —Seht mich an: ich kann es tragen.Aber ganz müßt ich verzagen,Wenn der Tod die liebste LiebeFort von meiner Seite triebe,Ich allein im Elend bliebe.Helfe Gott mir, müßt ich's tragen.",l0090128,Helfe Gott mir,"Lagarde, Paul de",3,5,Neue Lieder der besten neueren Dichter für's Volk. Zusammengestellt v. Dr. L. Jacobowski. Berlin 1899.,b'1899',"Jacobowski, Ludwig [alt. Jakobowsky, Ludwig]"
