,text,ID,Titel,Autor,Strophen,Verse,Anthologie,Jahr,Hrsg
68,"Es zieht, von schwarzem Flor umhangen,Ein stiller Leichenzug heran,Zum letzten Gruß die Glocken klangenVom Heimatdorf dem müden Mann —Da plötzlich an dem MeilensteineHält er wie festgewurzelt still,Es naht mit blutigrotem ScheineDer Eilzug mit dem Mahnruf schrill —Er jagt dahin durch blüh'nde Auen,Aufzuckend, wie ein roter Blitz. —Mir faßt das Herz ein tiefes GrauenDoch ob des Schicksals schnöden Witz —Der Wandrer, der auf letzter StraßeSich sehnet nach des Grabes Rast,Muß warten, daß vorüberweheDes Lebens ungestüme Hast!",l0090249,Blitzzug und Leichenzug,"Peschier, Eugène",2,8,Neue Lieder der besten neueren Dichter für's Volk. Zusammengestellt v. Dr. L. Jacobowski. Berlin 1899.,b'1899',"Jacobowski, Ludwig [alt. Jakobowsky, Ludwig]"
69,"Die Glocke tönt! — Das erste Läuten!Wie flog die Zeit doch pfeilgeschwind!Ich will zum Wagen dich begleiten,Gib dein Gepäck, und komm, mein Kind!Die Glocke tönt — das zweite Läuten!Nun ist es Ernst — bist du bereit?Noch einen Kuß— noch einen zweiten,Nun aber rasch — es drängt die Zeit...Die Glocke tönt — das dritte Läuten!Durchs Fenster noch ein letzter Blick —Es rollt der Zug... Zwei Tränen gleiten...Der Himmel hüte dein Geschick!",l0090265,Abschied,"Wilhelm, Paul",3,4,Neue Lieder der besten neueren Dichter für's Volk. Zusammengestellt v. Dr. L. Jacobowski. Berlin 1899.,b'1899',"Jacobowski, Ludwig [alt. Jakobowsky, Ludwig]"
70,"Ihr lieben Spielleut, stellt das Fiedeln ein,Streut Rosmarin, ihr lieben Mägdelein;Die schöne Lore liegt im Totenschrein.Und gestern in des Maienfestes Glanz,Wie flog ihr Haar, wie flatterte der Kranz!Der Burgherr selber führte sie zum Tanz.Er tanzte mit ihr auf dem grünen Plan,Nie führt ein schöneres Paar den Reigen an;Die finstere Herrin schaute vom Altan.Er tanzte mit ihr durch den Laubengang,Er tanzte, mit ihr durch den Wiesenhang,Er tanzte, bis die letzte Saite sprang.Und als den durstigen Tänzern aufgetischt,Und Paar an Paar sich am Bankett erfrischt,Die Herrin selbst hat ihr Sorbet gemischt.Ihr lieben Spielleut', stellt das Fiedeln ein,Streut Rosmarin, ihr lieben Mägdelein;Die schöne Lore liegt im Totenschrein.",l0090285,Die schöne Lore,"Fitger, Arthur",6,3,Neue Lieder der besten neueren Dichter für's Volk. Zusammengestellt v. Dr. L. Jacobowski. Berlin 1899.,b'1899',"Jacobowski, Ludwig [alt. Jakobowsky, Ludwig]"
71,"O Sonnensegen, o Fichtenduft!O Moos wie Sammt und Seide!Ich wirble meinen Hut in die LuftUnd weine vor lauter Freude.Ich kann mich fassen und halten kaum,Kann mich nicht halten und fassen,Umarmen möcht ich den blinkenden Baum,Glückselig über die Maßen...",l0090095,Sonnensegen,"Henckell, Karl",2,4,Neue Lieder der besten neueren Dichter für's Volk. Zusammengestellt v. Dr. L. Jacobowski. Berlin 1899.,b'1899',"Jacobowski, Ludwig [alt. Jakobowsky, Ludwig]"
72,"Aus der Eltern Macht und HausTritt die zücht'ge Braut herausAn des Lebens Scheide —Geh und lieb' und leide!Freigesprochen, unterjocht,Wie der junge Busen pochtIm Gewand von Seide —Geh und lieb' und leide!Frommer Augen helle LustÜberstrahlt an voller BrustBlitzendes Geschmeide —Geh und lieb' und leide!Merke dir's, du blondes Haar!Schmerz und Lust Geschwisterpaar,Unzertrennlich beide —Geh und lieb' und leide!",l0090156,Hochzeitslied,"Meyer, Conrad Ferdinand [alt. Meier, Conrad Ferdinand; Meyer, Konrad Ferdinand]",4,4,Neue Lieder der besten neueren Dichter für's Volk. Zusammengestellt v. Dr. L. Jacobowski. Berlin 1899.,b'1899',"Jacobowski, Ludwig [alt. Jakobowsky, Ludwig]"
73,"Das ist das Haus am WegeUnd drüber steht der Mond ,Dort hab ich einst im Lenze,Im grünen Lenz gewohnt.Ringsum liegt Schnee, es dunkelt,Ich schaue still empor,Durch kahle Äste funkeltEin einsam Licht hervor.Es hat mich hergetrieben —O Garten, stiller Mond;Wo ist das Glück geblieben,Das hier mit mir gewohnt?",l0090121,Das Haus am Wege,"Klie, Anna",3,4,Neue Lieder der besten neueren Dichter für's Volk. Zusammengestellt v. Dr. L. Jacobowski. Berlin 1899.,b'1899',"Jacobowski, Ludwig [alt. Jakobowsky, Ludwig]"
74,"Straße glatt, wie ausgefegt,Selten poltert noch ein Wagen;Knaben nur, die unentwegtIhre Bronze-Reifen schlagen.Vogelruf in blauer Luft —Kleine Wölkchen, weiß wie Seide —Mädchen, das der andern ruft,Und schon schwatzen beide.Und nun stehn sie vor der Tür,Überm Busen straff die Schürze,Und ein langer GrenadierNebenan als Sonntagswürze!Daß er's grad auf Marie,Meine Wäsch'rin, abgesehen,Freut mich sehr, je öfter sieBeieinander stehen.Schultern breit und Taille schmal,Arme, die das Kleid zerreißen,Er wie ein LaternenpfahlUnd kann sicher Steine beißen.Ach, das gäb' ein gutes Paar,Daß sie Gott zusammenführe!Segen käm' da Jahr für Jahr —Unser Land braucht Grenadiere!",l0090114,Sonntag Nachmittag,"Jacobowski, Ludwig",3,8,Neue Lieder der besten neueren Dichter für's Volk. Zusammengestellt v. Dr. L. Jacobowski. Berlin 1899.,b'1899',"Jacobowski, Ludwig [alt. Jakobowsky, Ludwig]"
75,"Mein zitternd Herz, verrat mich nicht,Sei stumm, errötend Angesicht!Ihr Augen, die ihn kommen seht,Gebt acht, daß ihr ihm nichts gesteht!Ein scheuer Blick, ein ernster Gruß,Und weiter eilt mein flücht'ger Fuß —O du mein Wunsch bei Tag und Nacht,Wann sprichst du, was mich selig macht?",l0090119,Mädchenlied,"Klie, Anna",2,4,Neue Lieder der besten neueren Dichter für's Volk. Zusammengestellt v. Dr. L. Jacobowski. Berlin 1899.,b'1899',"Jacobowski, Ludwig [alt. Jakobowsky, Ludwig]"
76,"Zersplissen ist mein HauptVon schwarzem Wolkenwetter;Herbstwind und Regen raubtDie abgestorbenen Blätter.So rag' ich ganz alleinAus ödem Heidekraut —Und — träume von dem Hain,Der weit verloren — blaut.Oft, wenn mit grimmer WuchtMich packt ein nächtlich BrausenRaff' ich mit jähem GrausenZusammen mich — zur Flucht;Doch halten zähe SchollenMich an den Wurzeln fest...Da steh' ich nun mit Grollen,Wild schüttelnd mein Geäst.",l0090266,Einsamer Baum,"Wille, Bruno",2,8,Neue Lieder der besten neueren Dichter für's Volk. Zusammengestellt v. Dr. L. Jacobowski. Berlin 1899.,b'1899',"Jacobowski, Ludwig [alt. Jakobowsky, Ludwig]"
77,"Der Kuckuck ruft: kuku, kuku!Mein Börslein schüttle ich dazu;Die Nachtigall singt auch im Hain,Ich denke an ein Mädel fein.Ihr guten Vöglein, helft geschwind,Bin ein verlassen Sonntagskind;Herr Kuckuck, meine Schulden zahl',O mach mich jung, Frau Nachtigall!",l0090124,Der Kuckuck ruft,"Königsbrunn-Schaup, Franz von [Königsbrun-Schaup; Königsbrunn-Schaup]",2,4,Neue Lieder der besten neueren Dichter für's Volk. Zusammengestellt v. Dr. L. Jacobowski. Berlin 1899.,b'1899',"Jacobowski, Ludwig [alt. Jakobowsky, Ludwig]"
78,Im Morgengrauen schritt ich fort —Nebel lag in den Gassen...In Qualen war mir das Herz verdorrt —Die Lippe sprach kein Abschiedswort —Sie stöhnte nur leise: Verlassen!Verlassen! Kennst du das Marterwort?Das frißt wie verruchte Schande!In Qualen war mir das Herz verdorrt —Im Morgengrauen ging ich fort —Hinaus in die dämmernden Lande!Entgegen dem jungen Maientag:Das war ein seltsam Passen!Mählich wurde die Welt nun wach —Was war mir der prangende Frühlingstag —Ich stöhnte nur leise: Verlassen!,l0090282,Verlassen,"Conradi, Hermann",3,5,Neue Lieder der besten neueren Dichter für's Volk. Zusammengestellt v. Dr. L. Jacobowski. Berlin 1899.,b'1899',"Jacobowski, Ludwig [alt. Jakobowsky, Ludwig]"
79,"Um seine tollen StudentenjahreFlatterten einst ihre Mädchenhaare.Er wurde ein großer Mann unterdessen, —Sie hat beim Nähzeug ihn nie vergessen.Wenn die Wochenblättchen kamen:Sonntags, las weinend sie oft seinen Namen.Sammelte alles — welk schon die Hände —Daß sie ein liebes Päckchen draus bände.Um seine tollen StudentenjahreFlatterten ja ihre Mädchenhaare.",l0090154,Die alte Jungfer,"Maria, Karl",1,10,Neue Lieder der besten neueren Dichter für's Volk. Zusammengestellt v. Dr. L. Jacobowski. Berlin 1899.,b'1899',"Jacobowski, Ludwig [alt. Jakobowsky, Ludwig]"
80,"Guhannisnacht, Guhannisnacht,Gliehfinkle flieng in DunkelnDe Rusen duften so sies,Guldstaernle in Himmel funkeln.Doch haeller wie Stärnle leichten de Aang,Die mich im de Ruh gebracht,Und rether wie Rusen brännt ihr Mund,Daer wie de Kärschen an Baeme lacht.Se schant mer ins Aag, se drickt mer de Hand,Tut sich nah'ne Hals mer schmeißen,Da pucht ihr Haerz an meinen HaerzWie zwe Hammer af gliehiges Eisen;Do kißt se mich hoes, do kißt se mich will,Su will wie der Blitz af'n Aechbaam kracht,Du bist de schaennste Zeit fer de Lieb,Guhannisnacht, Guhannisnacht!",l0090284,Guhannisnacht,"Doehler, Gottfried",2,8,Neue Lieder der besten neueren Dichter für's Volk. Zusammengestellt v. Dr. L. Jacobowski. Berlin 1899.,b'1899',"Jacobowski, Ludwig [alt. Jakobowsky, Ludwig]"
81,"Du glaubtest nicht an frohe Tage mehr,Verjährtes Leid ließ nimmer dich genesen;Die Mutterfreude war für dich zu schwer,Das Leben war dir gar zu hart gewesen.Er saß bei dir in letzter Liebespflicht;Noch eine Nacht, noch eine war gegeben!Auch die verrann; dann kam das Morgenlicht.""Mein guter Mann, wie gerne wollt' ich leben!""Er hörte still die sanften Worte an,Wie sie sein Ohr in bangen Pausen trafen:""Sorg für das Kind — ich sterbe, süßer Mann.""Dann halbverständlich noch: ""Nun will ich schlafen.""Und dann nichts mehr; du wurdest nimmer wach,Dein Auge brach, die Welt ward immer trüber;Der Atem Gottes wehte durchs Gemach,Dein Kind schrie auf, und dann warst du hinüber.Das aber kann ich nicht ertragen,Daß so wie sonst die Sonne lacht;Daß wie in deinen LebenstagenDie Uhren gehn, die Glocken schlagen,Einförmig wechseln Tag und Nacht;Daß, wenn des Tages Lichter schwandenWie sonst der Abend uns vereint;Und daß, wo sonst dein Stuhl gestanden,Schon andre ihre Plätze fandenUnd nichts dich zu vermissen scheint;Indessen von den GitterstäbenDie Mondesstreifen schmal und kargIn deine Gruft hinunterwebenUnd mit gespenstig trübem LebenHinwandeln über deinen Sarg.",l0090231,Die Tote,"Storm, Theodor",7,5,Neue Lieder der besten neueren Dichter für's Volk. Zusammengestellt v. Dr. L. Jacobowski. Berlin 1899.,b'1899',"Jacobowski, Ludwig [alt. Jakobowsky, Ludwig]"
82,"Weiß nicht, was mich so still,So seltsam traurig macht —Ich hab' doch sonst so hellIm Sonnenschein gelacht!Weiß nicht, was mich so engt,Mich so zerrissen stimmt,Daß oft ein kleines WortMir alle Freude nimmt.Weiß nur, daß in mir nachtsSo manche Träne rinnt —Und daß ich weinen könnt'Wie ein geschlagen Kind.",l0090299,Weiß nicht —,"Holm, Kurt",3,4,Neue Lieder der besten neueren Dichter für's Volk. Zusammengestellt v. Dr. L. Jacobowski. Berlin 1899.,b'1899',"Jacobowski, Ludwig [alt. Jakobowsky, Ludwig]"
83,"Es läuten zur Kirche die Glocken,Die Eltern, sie gingen schon aus,Drei Kindlein in goldenen Locken,Die sitzen noch unter dem Haus.Die muntern, unmüßigen GästeSind noch für die Kirche zu klein,Doch wollen am heiligen FesteSie fromm wie die Alten schon sein.Hat jedes ein Buch sich genommenUnd hält es verkehrt auf dem Schoß,Draus singen die Schelme, die frommen,Mit schallender Stimme drauf los.Weiß selber noch keins, was es singet,Singt jedes in anderem Ton;Singt immer, ihr Kindlein, es dringetAuch so zu dem himmlischen Thron.Dort stehn eure Engel, die reinen,Und singen dem Vater der Welt,Der stets aus dem Munde der KleinenAm liebsten sein Lob sich bestellt.Singt immer, da drüben im Garten,Da singt's in die Wette mit euch;Die Vöglein sind es, die zarten,Die zwitschern im jungen Gesträuch.Singt immer; ihr singet im Glauben,Das ist ja dem Heiland genug,Ein Herz ohne Falsch wie die TaubenNimmt frühe gen Himmel den Flug.Singt immer; wir singen, die Alten,Und lesen die Schrift mit Verstand,Und doch ach! wie hundertmal haltenDas Buch wir verkehrt in der Hand!Singt immer; wir singen die LiederNach Noten, so wie sich's gehört,Und doch — vom Gezänke der BrüderWie oft wird der Einklang gestört!Singt immer; aus irdischen HallenDer hehrste und herrlichste Chor,Was ist er? ein kindisches LallenEin Hauch in des Ewigen Ohr.",l0090077,Kindergottesdienst,"Gerok, Karl",10,4,Neue Lieder der besten neueren Dichter für's Volk. Zusammengestellt v. Dr. L. Jacobowski. Berlin 1899.,b'1899',"Jacobowski, Ludwig [alt. Jakobowsky, Ludwig]"
84,"Wie mir dieser JuliwochenEinsam schöne Zeit verrann!Schauend in dem Schatten kühlenDurft' ich meine Seele fühlen,Die des Glücks Gesichte sann! —Golden sah ich breit sich bräunenWellenweich das Ährenfeld;Blutrot glomm auf allen WegenWilder Mohn im Windesregen,Lerchenselig war die Welt.Lerchenselig meine Seele,Die auf Gottts Wegen ging —Eine Fülle, eine Güte! —Und im Duften jeder BlüteStillsten Gruß der Welt empfing.",l0090259,Im Dorfe,"Weigand, Wilhelm",3,5,Neue Lieder der besten neueren Dichter für's Volk. Zusammengestellt v. Dr. L. Jacobowski. Berlin 1899.,b'1899',"Jacobowski, Ludwig [alt. Jakobowsky, Ludwig]"
85,"O laß mich nur von ferne stehnUnd hangen stumm an deinem Blick;Du bist so jung, du bist so schön,Aus deinen Augen lacht das Glück.Und ich so arm, so müde schon,Ich habe nichts, was dich gewinnt.O wär' ich doch ein Königssohn,Und du ein arm verlornes Kind!",l0090229,Bettlerliebe,"Storm, Theodor",2,4,Neue Lieder der besten neueren Dichter für's Volk. Zusammengestellt v. Dr. L. Jacobowski. Berlin 1899.,b'1899',"Jacobowski, Ludwig [alt. Jakobowsky, Ludwig]"
86,"""Ahoi! Klaas Nielsen und Peter Jehann!Kiekt nach, ob wir noch nich to Mus sind!Ji hewt doch gesehn den Klabautermann?Gott lob, dat wi wedder to Hus sind!""Die Fischer riefen's und stießen ans LandUnd zogen die Kiele bis hoch an den Strand,Denn dumpf an rollten die Fluten;Han Jochen aber rechnete nachUnd schüttelte finster sein Haupt und sprach:""Een Boot is noch buten!""Und ernster keuchte die braune ScharDem Dorf zu über die Dünen,Schon grüßten von fern mit zerzaustem HaarDie Frau'n an den Gräbern der Hünen.Und ""Korl!"" hießes und ""Leiw Marie!""""'T is doch man schön, dat je wedder hie!""Dumpf an rollten die Fluten —""Un Hinrich, min Hinrich? Wo is denn dee?!""Und Jochen wies in die brüllende See:""Een Boot is noch buten!""Am Ufer dräute der Möwenstein,Drauf stand ein verrufnes Gemäuer,Dort schleppten sie Werg und Strandholz hineinUnd gossen Öl in das Feuer.Das leuchtete weit in die Nacht hinausUnd sollte rufen: O komm nach Haus!Dumpf an rollten die Fluten —Hier steht dein Weib in Nacht und WindUnd jammert laut und küßt dein Kind:""Een Boot is noch buten!""Doch die Nacht verrann, und die See ward still,Und die Sonne schien in die Flammen,Da schluchzte die Ärmste: ""As Gott will!""Und bewußtlos brach sie zusammen!Sie trugen sie heim auf schmalem Brett,Dort liegt sie nun fiebernd im Krankenbett,Und draußen plätschern die Fluten;Dort spielt ihr Kind, ihr ""lütting Johann"",Und lallt wie träumend dann und wann -""Een Boot is noch buten!"" —",l0090103,"""Een Boot is noch buten!""","Holz, Arno",4,10,Neue Lieder der besten neueren Dichter für's Volk. Zusammengestellt v. Dr. L. Jacobowski. Berlin 1899.,b'1899',"Jacobowski, Ludwig [alt. Jakobowsky, Ludwig]"
87,"Wie geheimes LispelnRieselt's durch die Nacht...All' die Blüten habenVor sich hingelacht,Flüstern sich's einanderZu im stillen Tal:Eine HeckenroseKüßte der Mondenstrahl.",l0090043,Nachtgeschwätz,"Evers, Franz",2,4,Neue Lieder der besten neueren Dichter für's Volk. Zusammengestellt v. Dr. L. Jacobowski. Berlin 1899.,b'1899',"Jacobowski, Ludwig [alt. Jakobowsky, Ludwig]"
88,"Noch ruht im Dorfe Jung und Alt,Am Himmel stehn die Sterne;Der Morgen dämmert florumwalltUnmerklich in der Ferne.Da wird ein Türlein aufgemachtMit Fürsicht übermaßen:Ein Blondchen schleicht mit VorbedachtHeraus und längs der Straßen.Die Füße nackt und groß und braun,Das runde Köpfchen glühend;Verzaustes Haar — durchs Linnen schaunDie Brüstchen prall und blühend.Sie blickt noch einmal ringsherum,Als wie verscheucht ein Mäuschen;Dann reckt sie sich und lächelt stummUnd schlüpft in eins der Häuschen.",l0090179,Nachtbild,"Reichel, Eugen",4,4,Neue Lieder der besten neueren Dichter für's Volk. Zusammengestellt v. Dr. L. Jacobowski. Berlin 1899.,b'1899',"Jacobowski, Ludwig [alt. Jakobowsky, Ludwig]"
89,"""Mutter,"" schallt es immerfortUnd fast ohne Pause.""Mutter"" hier und ""Mutter"" dortIn dem ganzen Hause.Überall zugleich zu sein,Ist ihr nicht gegeben,Sonst wohl hätte sie, ich mein',Ein bequemer Leben.Jedes ruft, und auf der StellWill sein Recht es kriegen,Und sie kann doch nicht so schnellWie die Schwalben fliegen.Ich fürwahr bewund're sie,Daß sie noch kann lachen,Was allein hat sie für Müh',Alle satt zu machen.Kann nicht einen AugenblickSich zu ruhn erlauben;Und das hält sie gar für GlückSollte man es glauben?",l0090241,Mutter,"Trojan, Johannes",5,4,Neue Lieder der besten neueren Dichter für's Volk. Zusammengestellt v. Dr. L. Jacobowski. Berlin 1899.,b'1899',"Jacobowski, Ludwig [alt. Jakobowsky, Ludwig]"
90,"Nacht fließt in Tag und Tag in Nacht,Der Bach zum Strom, der Strom zum Meer —In Tod zerrinnt des Gebens Pracht,Und Tod zeugt Leben licht und hehr.Und jeder Geist, der brünstig strebt,Dringt wie ein Quell in alle Welt, —Was du erlebst, hab ich erlebt,Was mich erhellt, hat dich erhellt.All' sind wir eines Baums Getrieb,Ob Ast, ob Zweig, ob Mark, ob Blatt —Gleich hat Natur uns alle lieb,Sie, unser aller Ruhestatt.",l0090089,Natur,"Hart, Heinrich",3,4,Neue Lieder der besten neueren Dichter für's Volk. Zusammengestellt v. Dr. L. Jacobowski. Berlin 1899.,b'1899',"Jacobowski, Ludwig [alt. Jakobowsky, Ludwig]"
91,"Ach, nur ein paar Bretter zum eigenen Haus,Und wäre es auch winzig und klein,Wie sollte mein Schatz aus dem Fenster herausDann lachen und lustig sein!Drei Hände voll Erde, das wäre genugZum eignen Haus auf eigenem Grund;Ich bin bescheiden, ich will nicht viel,Wir sind ja noch jung und gesund.So warte doch, warte nur fein,Drei Bretter, wie bald sind sie dein,Und dein Schatz wirft drei Hände voll ErdeNoch selber hinter dir drein.",l0090273,Nur Geduld!,"Aram, Kurt",3,4,Neue Lieder der besten neueren Dichter für's Volk. Zusammengestellt v. Dr. L. Jacobowski. Berlin 1899.,b'1899',"Jacobowski, Ludwig [alt. Jakobowsky, Ludwig]"
92,"Die Peitsche pfeift, es klirrt der Sporn,Die Renner streifen durch das Korn,Das im Sommerwinde wogt und wellt.Ein Schuß. Aus heißem Sattel fälltDer vorderste der Reiter fällt ins gelbe Korn,Rotblutend ins gelbe Korn,Das im Sommerwinde wogt und wellt.Die Hufen trommeln, die Schollen fliegen,Rufen, Blitzen, Wiehern im Wald... und tiefe Stille...In der Ackerfurche dort bleibt er liegen,Die Lippen brechen, sprechen: ""...dein Wille — ""Im Bügelriemen noch hängt sein Sporn;Und neben ihm auf sonnenhellem FeldRauft noch sein Gaul in hohem Korn,Das im Sommerwinde wogt und wellt.",l0090211,Reifer Sommer,"Scholz, Wilhelm von",3,6,Neue Lieder der besten neueren Dichter für's Volk. Zusammengestellt v. Dr. L. Jacobowski. Berlin 1899.,b'1899',"Jacobowski, Ludwig [alt. Jakobowsky, Ludwig]"
93,"Vom nahen Eisenwerke,Berußt, mit schwerem Gang,Kommt mir ein Mann entgegen,Den Wiesenpfad entlang.Mit trotzig finstrer Miene,Wie mit sich selbst im Streit,Greift er nach seiner Mütze —Gewohnheit alter Zeit.Es blickt dabei sein AugeMir musternd auf den Rock,Und dann beim WeiterschreitenSchwingt er den Knotenstock.Ich ahne, was im HerzenUnd was im Hirn ihm brennt:""Das ist auch einer,"" denkt er,""Der nicht die Arbeit kennt,Lustwandelnd hier im Freien,Verdaut er üpp'ges Mahl,Indes wir darbend schmiedenDas Eisen und den Stahl.Er sucht den Waldesschatten,Da wir am Feuer stehnUnd in dem heißen BrodemLangsam zu Grunde gehn.Der soll es noch erfahren,Wie es dem Menschen tut,Muß er das Atmen zahlenMit seinem Fleisch und Blut!""Verziehen sei dir alles,Womit du schwer mich kränkst —Verziehen sei dir gerne;Du weißt nicht, was du denkst;Du hast ja nie erfahren —Des Geistes tiefes Müh'n,Du ahnst nicht, wie die SchläfenMir heiß vom Denken glühn.Du ahnst nicht, wie ich hämm'reUnd feile Tag für Tag —Und wie ich mich verbluteMit jedem Herzenschlag!",l0090198,Arbeitergruß,"Saar, Ferdinand von",1,40,Neue Lieder der besten neueren Dichter für's Volk. Zusammengestellt v. Dr. L. Jacobowski. Berlin 1899.,b'1899',"Jacobowski, Ludwig [alt. Jakobowsky, Ludwig]"
94,"O Dore am Bühl, wie bleich bist du,Dein Schuh ist nicht mehr blank!""O Nachbar vom Anger, wie geht es zu?Die Mutter ist so krank;Hab keine Zeit, muß warten und pflegen,Muß Schemel rücken und Kissen legen.""O Dore, ich kann dich bleich nicht seh'n,Geh durch das Gras im TauUnd laß die Blässe dir vergeh'n,Ich pflege die kranke Frau;Und kommst du wieder gesund herein,Dann pflegst du sie nicht mehr allein.""Nachbar, und stirbt die Mutter mir,Wer soll mir Tröster sein?""O Dore am Bühl, ich steh bei dir,Dann weinen wir zu zwei'n,Und nimmst du fürlieb, so hast du mich,Und auf den Händen trag' ich Dich.",l0090060,Dore am Bühl,"Fischer, J.G. [alt. Fischer, Johann Georg]",3,6,Neue Lieder der besten neueren Dichter für's Volk. Zusammengestellt v. Dr. L. Jacobowski. Berlin 1899.,b'1899',"Jacobowski, Ludwig [alt. Jakobowsky, Ludwig]"
95,"Klingen hör' ich muntre Weisen;Junges Völkchen stellt sich ein,Lustig um den Baum zu kreisen,Ein'ge Stunden froh zu sein.Ei, das will sich heiter fügen!Mädel, komm, da gibt's Vergnügen!Komm, wir schlüpfen mit hinein.Jedermann ist hier geladen, —Sieh' nur, wie sie keck sich drehn!Röcke flattern, dralle WadenLäßt man, schön bebändert, sehn.Wie die Bursche kräftig fassenIhre Dirnen! O, sie lassenAlles gern mit sich geschehn.Hier umengt sie keine Sitte;Dennoch adeln sie den Drang.Also, Mädel, komm — ich bitte —Dies Vergnügen währt nicht lang.Schnell hinein in diese Lücke;Weiter nun mit gutem Glücke —Hei, das geht mit Schwing und Schwang!Alles dreht sich mir im KreiseSchon herum — o Tänzernot!Ach, wir fallen aus dem Gleise —Mädel — stark! und was auch droht.Flink die Röcke zugeschlagen! —Solch ein Fall will nichts besagen —Mädel, werde nur nicht rot.",l0090180,Tänzchen im Freien,"Reichel, Eugen",4,7,Neue Lieder der besten neueren Dichter für's Volk. Zusammengestellt v. Dr. L. Jacobowski. Berlin 1899.,b'1899',"Jacobowski, Ludwig [alt. Jakobowsky, Ludwig]"
96,"Trunkfester Germanen SitteVor alten Zeiten es war,Zu drängen in Tisches MitteDer Krüge krachende Schar.Vielstimmig klangs von jeder Seit':""Es blüht eine Blume im weißen Kleid,Freunde, euch sei die Blume geweiht!""""""Prost Bruder, prost, du sollst leben!""""Fern drüben in anderen LandenTrinken sie schweigend den Wein, —Der Welsche hat's nie verstandenSein schäumendes Glas zu weih'n. —""Und galt bei uns das erste dem Freund,So sei mit dem zweiten die Liebe gemeint,Die Sonne, die dir ins Leben scheint!""""""Prost Bruder, prost, sie soll leben!""""Die Blüte der Rebe vergehet,Der steinerne Krug zerschellt,Ein Leben im Winde verwehet,Wenn's dem da droben gefällt. —Ein Jahr, da sang er an unserer Seit':""Es blüht eine Blume im weißen Kleid,"" —— Verwelket die Blüte, die Halde verschneit —Prost Bruder, sein Andenken lebe!",l0090159,Zutrunk,"Münchhausen, Börries Freiherr von [Münchhausen, Börries von]",6,4,Neue Lieder der besten neueren Dichter für's Volk. Zusammengestellt v. Dr. L. Jacobowski. Berlin 1899.,b'1899',"Jacobowski, Ludwig [alt. Jakobowsky, Ludwig]"
97,"Was weinst du so verlassenUnd birgst dein schweres Haupt?Der Pfingst zieht durch die Gassen,Vom Maibusch grün umlaubt.Hörst nicht das Lachen klingen?Ein Tanzen gibt's und Springen —Komm, sei noch einmal jung!""Muß ja mein Mägdlein meiden,Den herzgeliebten Hort,Mein Glück und Trost im Leiden,Mein Röslein ist verdorrt.Das leuchtete und glühte,Das lächelte und blühte —Nun treibt's der Wind im Staub.",l0090096,Der Mutter Leid,"Henckell, Karl",2,7,Neue Lieder der besten neueren Dichter für's Volk. Zusammengestellt v. Dr. L. Jacobowski. Berlin 1899.,b'1899',"Jacobowski, Ludwig [alt. Jakobowsky, Ludwig]"
98,"Es tat den beidenSo weh das Scheiden;Sie wollten klagen,Sich viel noch sagen —Und doch fand keinesEin einzig Wort.— So ging einesVom andern fort.",l0090120,Stummer Abschied,"Klie, Anna",1,8,Neue Lieder der besten neueren Dichter für's Volk. Zusammengestellt v. Dr. L. Jacobowski. Berlin 1899.,b'1899',"Jacobowski, Ludwig [alt. Jakobowsky, Ludwig]"
99,"Glühend im goldenen Abendschein,Ruhen die Wiesen und Wälder;Frischer Atem aus schattigem HainStreift über wogende Felder.Bläulich wiegt sich im duftigen HauchBlühender Flachs in der Runde —Sehnende Seele, nun ruhe du auch,Freu' dich der friedlichen Stunde!Glühend im goldenen Abendschein,Schwanken die wallenden Halme;Auf das dämmernde ErdenseinNeigt ein Engel die Palme.""Heilige Scholle, schenke uns Brot!""Beten die Kinder der Erde;Gott im scheidenden AbendrotHaucht sein unsterbliches Werde.",l0090219,Kinder der Erde,"Stern, Maurice Reinhold von [alt. Stern, Maurice-Reinhold von; Stern, Maurice von]",2,8,Neue Lieder der besten neueren Dichter für's Volk. Zusammengestellt v. Dr. L. Jacobowski. Berlin 1899.,b'1899',"Jacobowski, Ludwig [alt. Jakobowsky, Ludwig]"
100,"Die Prinzessin fährt zum Hochzeitsfest,Vier Schimmel am Wagen,Mit rotem KragenDie Kutscher und silberbetreßt.Trara!Hell schmettern Trompeten und Trompetinen,Prinzessin sitzt da mit süßen MienenIn Galatoilette und Gloria.Die Menge verneigt sich und hebt den Hut;Wie prunkt die Karosse!Wir stehn in der Gosse..""Ach Gott, so eine hat's gut...""Trara!Hell schmettern Trompeten und Trompetinen,Eine Kleine sagt's mit sauren MienenUnd glänzt doch in Schönheit und Gloria.Die Prinzessin hab' ich nicht mehr gesehn,Ich sah nur die feine,Die liebe KleineIm wollenen Röckchen stehn.Trara!Hell schmettern Trompeten und Trompetinen,Doch alles hat golden überschienenDer armen Schönheit Gloria.",l0090275,Zwei Prinzessen,"Bierbaum, Otto Julius",3,8,Neue Lieder der besten neueren Dichter für's Volk. Zusammengestellt v. Dr. L. Jacobowski. Berlin 1899.,b'1899',"Jacobowski, Ludwig [alt. Jakobowsky, Ludwig]"
