,text,ID,Titel,Autor,Strophen,Verse,Anthologie,Jahr,Hrsg
137,"Und schau' ich Gottes Welt im Frühlingslicht,Wenn junges Grün erglänzt auf allen Triften,Wenn Blütenschnee aus dürren Ästen bricht,Und Lustgesang ertönt aus blauen Lüften,Dann hoff' ich wieder, und noch glaub' ich nichtAn die Erfüllung schon der letzten Schriften,Wo krachend diese sündenmorsche WeltIn Flammen des Gerichts zusammenfällt.Dann säuselt's wie ein himmlisches ErbarmenMich tröstlich an im lauen Frühlingswind;Dann lächelt, wie gewiegt in Mutterarmen,Die Erde mir, ein neugebornes Kind;Ich seh' den alten Feigenbaum erwärmenIm Sonnenschein, den gnädig und gelindIhm noch dies Jahr vergönnt die ew'ge Liebe,Ob er nicht Blüten noch und Früchte triebe? —Und schau' ich in ein Kinderangesicht,Die offne Stirn, die herzlichtreuen Augen,Aus denen keck der Mut der Unschuld spricht,Die frisch den Glanz der Schöpfung in sich saugen,Dann hoff ich wieder, und noch glaub' ich nicht,Daß garnichts mehr die Menschheit sollte taugen,Daß sie schon dürres Holz, zu nichts mehr gut,Als um zu brennen in der ew'gen Glut.Dann freu' ich mich: noch ist nicht ganz verlorenDes Schöpfers Bild in dieser Sündenwelt,Noch werden Kinder unserm Gott geboren,Wie frischer Tau auf morgenrotem Feld;Wer weiß, wozu dies Kindlein sei erkoren?Ob's ein Prophet vielleicht, ein Zukunftsheld?Denn Gottes Geist will noch in viel GestaltenDie Fülle seiner Herrlichkeit entfalten.",l0090289,Frühlingsglaube,"Gerok, Karl",4,8,Neue Lieder der besten neueren Dichter für's Volk. Zusammengestellt v. Dr. L. Jacobowski. Berlin 1899.,b'1899',"Jacobowski, Ludwig [alt. Jakobowsky, Ludwig]"
138,"Noch ist die blühende, goldene Zeit,O, du schöne Welt, wie bist du so weit!Und so weit ist mein Herz und so klar wie der Tag,Wie die Lüfte, durchjubelt von Lerchenschlag!Ihr Fröhlichen singt, weil das Leben noch mait:Noch ist die schöne, die blühende Zeit,Noch sind die Tage der Rosen!Frei ist das Herz, und frei ist das Lied,Und frei ist der Bursch, der die Welt durchzieht,Und ein rosiger Kuß ist nicht minder frei,So spröd' und verschämt auch die Lippe sei.Wo ein Lied erklingt, wo ein Kuß sich beut,Da heißt's: Noch ist blühende, goldene Zeit,Noch sind die Tage der Rosen!Ja, im Herzen tief innen ist alles daheim,Der Freude Saaten, der Schmerzen Keim.Drum frisch sei das Herz und lebendig der Sinn,Dann brauset ihr Stürme daher und dahin!Wir aber sind allzeit zu singen bereit:Noch ist die schöne, goldene Zeit,Noch sind die Tage der Rosen!",l0090194,Tage der Rosen,"Roquette, Otto",3,7,Neue Lieder der besten neueren Dichter für's Volk. Zusammengestellt v. Dr. L. Jacobowski. Berlin 1899.,b'1899',"Jacobowski, Ludwig [alt. Jakobowsky, Ludwig]"
139,"Liegt ein Dörflein mitten im Walde,Überdeckt von Sonnenschein,Und vor dem letzten Haus an der HaldeSizt ein steinalt Mütterlein.Sie läßt den Faden gleitenUnd Spinnrad Spinnrad seinUnd denkt an die alten ZeitenUnd nickt und schlummert ein.Heimlich schleicht sich die MittagsstilleDurch das flimmernde grüne Revier.Alles schläft; selbst Drossel und GrilleUnd vorm Pflug der müde Stier.Da plötzlich kommt es gezogenBlitzend den Wald entlangUnd vor ihm hergeflogenWie Trommel- und Pfeifenklang.Und in das Lied vom alten BlücherJauchzen die Dörfler: ""Sie sind da!""Und die Mädels schwenken die Tücher,Und die Jungens rufen: ""Hurrah!""Gott schütze die goldenen Saaten,Dazu die weite Welt;Des Kaisers junge SoldatenZiehn wieder ins grüne Feld!Sieh, schon schwenken sie um die Halde,Wo das letzte der Häuschen lacht.Schon verschwinden die ersten im Walde,Und das Mütterchen ist erwacht.Versunken in tiefes Sinnen,Wird ihr das Herz so schwer,Und ihre Tränen rinnen:""So Einer war auch Er!""",l0090104,"""So Einer war auch Er!""","Holz, Arno",4,8,Neue Lieder der besten neueren Dichter für's Volk. Zusammengestellt v. Dr. L. Jacobowski. Berlin 1899.,b'1899',"Jacobowski, Ludwig [alt. Jakobowsky, Ludwig]"
140,"Aus einem dunklen ForsteDrängt sich ein Hüttlein klein,Auf seinen glühenden FensternZuckt sterbend der Abendschein.Auf seiner Schwelle träumetEin junges Menschenpaar;Ihr Haupt ruht an seiner Schulter,Seine Lippe streift ihr Haar.Aus finsterem WaldesschweigenTritt sacht die Nacht heraus,Da schreiten, eng umschlungen,Die beiden in ihr Haus.Ein Lichtlein ist drin erglommen,Doch hat's nicht lang gewacht —Um die stumme dunkle HütteKreist sternenhell die Nacht...",l0090182,Die Hütte,"Remer, Paul",4,4,Neue Lieder der besten neueren Dichter für's Volk. Zusammengestellt v. Dr. L. Jacobowski. Berlin 1899.,b'1899',"Jacobowski, Ludwig [alt. Jakobowsky, Ludwig]"
141,"Das schien mir immer schlimm getan,Mußt junges Blut den Greis umfahn.Nun weiß ich selber, wie das sei,Wenn man dem Winter gibt den Mai.Die Schwestern brachten reich Geschmeid,Dazu ein überteuer Kleid:Mit Seide ward ich angetan —Ich hatte keine Freude dran.Mir sprachen alle herzlich zuUnd sagten: Selig Liebe du!Mir wies der Spiegel an der WandZwei Augen, drin ein Weinen stand.Sie priesen ihn gar überlaut,Er selber kam, er hieß mich Braut,Er sprach gar liebevoll und klug,Was nur mein Herz so ängstlich schlug?An meinem Finger stak der Ring —Der Freier schied — wie müd' er ging!Was er gewollt? weiß nicht genau —Ich sah nur eins — sein Haar ist grau!...",l0090037,Das Mädchen,"David, Jakob Julius [David, J.J.]",5,4,Neue Lieder der besten neueren Dichter für's Volk. Zusammengestellt v. Dr. L. Jacobowski. Berlin 1899.,b'1899',"Jacobowski, Ludwig [alt. Jakobowsky, Ludwig]"
142,"Du junge schöne Bleicherin,Wo führst du denn dein Leinen hin?Rasch spring' ich auf den Bock zu dir,Zusammen dann kutschieren wirAuf deine grüne Wiese.Da breitest du im SonnenscheinDie Hemden fein, die Höschen fein.Ich seh dir zu, mein Herz wird laut,Wir spielen Bräutigam und BrautAuf deiner grünen Wiese.Und nachts, im milden Mondenschein,Bewachst dein Leinen du allein.Ich geb's nicht zu, es ängstigt mich,Vor Raub und Mord beschütz' ich dichAuf deiner grünen Wiese.",l0090141,Die Wäscherin auf der Wiese,"Liliencron, Detlev von [Liliencron, Detlev Freiherr von; alt. Liliencron, Detlev Frhr. von]",3,5,Neue Lieder der besten neueren Dichter für's Volk. Zusammengestellt v. Dr. L. Jacobowski. Berlin 1899.,b'1899',"Jacobowski, Ludwig [alt. Jakobowsky, Ludwig]"
143,"Die alte Frau hat ein hartes Gesicht,Doch kluge, sanfte Augen,Die wenig mehr beim PfenniglichtUnd nicht zum Weinen taugen.Sie war ein Balg... als Findelkind,Verlass'ner als die Armen,Bat weder Herren noch GesindUm Futter und Erbarmen.Sie griff fest zu und schaffte strammWie ehrbar-ernste Leute,Daß nie sie Unverdientes nahm,Erfreut das Weib noch heute.Sie zeigt auch jetzt mit BauernstolzErdarbte Talerscheine:""Die sind mein unverbranntes Holz,Meine ungetrunkenen Weine...Die sind mein ungegessenes Brot,Auf jedem steht geschrieben:Ein Alter ohne Schand und Not...Und was mir Gott schuldig geblieben.""",l0090027,Ein Balg,"Christen, Ada",5,4,Neue Lieder der besten neueren Dichter für's Volk. Zusammengestellt v. Dr. L. Jacobowski. Berlin 1899.,b'1899',"Jacobowski, Ludwig [alt. Jakobowsky, Ludwig]"
144,"Viel Tausend haben sich aufgemachtIn stürmischer, schneeiger Winternacht.Die Menge staut sich, steht Fuß an Fuß,Dem Kaiser zu danken mit letztem Gruß,Plötzlich am Schloß zwei Flammen wie Schlangen,Vom Dom her wimmert ein Glockenbangen,Bald dröhnt es gleichmäßig, ohn' UnterlaßIn grausamem Takt, in furchtbarem Baß.Und wo sich die Massen zusammengeschoben,Über die Köpfe, schwimmt hocherhobenEin dunkler Sarg, so tränenschwer,Ein Troß von Königen hinterher.Wie die Wolken erschrocken hasten,Der Wind packt: halt, halt! des Bahrtuchs Quasten,Doch durch das bewegte LüftelebenSeh' ich wohl hundert Adler schwebenMit wundervoll ruhigem Flügelschlag,So stolzes Geleit wie am Siegestag.Rauch schlägt wieder aus ehernen Becken,Drin die Feuer geschürt, den Rand überlecken.Die Erde zittert, dumpf ist es zu spüren,Wie die Hufe des Zuges das Pflaster berühren.Die Fackeln strecken als Leuchten sich vor,In den Helmen sich spiegelnd der Garde du Corps,Und senken sich nieder, verlöschen im Schnee —Vorüber, vorüber das schluchzende Weh.Aus der offenen Domtür tönt Orgelgebraus,Ein Palmenwald grüßt in den Winter hinaus.Alles grün, alles Frühling, wo sonst weißer Kalk,Lorbeer umlaubt den Katafalk.Selbst Gärten, die einst unser Sturmschritt geknickt,Heut haben sie Rosen und Kränze geschickt.""Laßt mich durch, die Gasse mir aufgetan,Laßt mich durch, laßt mich durch, sonst brech' ich mir Bahn!Noch einmal auf Knieen vor ihm will ich liegen,Meine Stirn an die purpurne Ruhstatt biegen.Bei Gravelotte, spät war die Stunde,Der König! rief es in weiter Runde.Und jauchzend hemmten wir seine Zügel,Bedeckten mit Küssen Hand und Bügel.Die Sonne in sinkender AbendflutUmrahmt seinen Helm in Gloriaglut,Sein Auge tropft, seine Lippe bebt,Mit ihm, mit ihm hab' ich's durchgelebt.""",l0090145,Vom toten Kaiser,"Liliencron, Detlev von [Liliencron, Detlev Freiherr von; alt. Liliencron, Detlev Frhr. von]",1,44,Neue Lieder der besten neueren Dichter für's Volk. Zusammengestellt v. Dr. L. Jacobowski. Berlin 1899.,b'1899',"Jacobowski, Ludwig [alt. Jakobowsky, Ludwig]"
145,"Nächtlich war's am stillen Weiher,Wo ich ihm zur Seite stand,Als im Wind mein langer SchleierSich um seinen Nacken wand.Ach, was ließ ich's nur geschehen,Daß er fest den Knoten schlang,Mich an seiner Hand zu gehen,Ein gefangnes Füllen, zwang.Denn seitdem auf allen WegenFühlt ich unzerreißlich stetsÜber mich und ihn sich legenMagisch jenes Schleiers Netz.Seit mich gar sein Arm umwindet,Schwand der Freiheit letzter Rest.Fessel, die uns beide bindet,Liebe Fessel, halte fest!",l0090126,Mädchenliebe,"Kurz, Isolde",4,4,Neue Lieder der besten neueren Dichter für's Volk. Zusammengestellt v. Dr. L. Jacobowski. Berlin 1899.,b'1899',"Jacobowski, Ludwig [alt. Jakobowsky, Ludwig]"
146,"Ich hab' kein Haus, ich hab' kein Nest,Ich hab' kein' Hochzeit und kein Fest;Ich hab' kein' Hof, ich hab' kein Feld,Ich hab' kein' Heimat auf der Welt.Am Himmel selbst der Schauerstrich,Den fürchten sie nicht so wie mich;Mir geht's nicht gut, mir geht's nicht schlecht —Und so, gerade so ist's recht...",l0090038,Habenichts,"David, Jakob Julius [David, J.J.]",1,8,Neue Lieder der besten neueren Dichter für's Volk. Zusammengestellt v. Dr. L. Jacobowski. Berlin 1899.,b'1899',"Jacobowski, Ludwig [alt. Jakobowsky, Ludwig]"
147,"Die Nixe liegt im MeeresgrundUnd dehnt die weißen Glieder:""Nach Küssen seufzt mein roter Mund,Will auf zur Erde wieder.Dort wartet mein des Grafen SohnIn brennend heißer Minne,Ich geb' ihm seiner Sehnsucht LohnUnd raub' ihm Herz und Sinne.""Die Nixe streift den grünen TangAus ihren gold'nen Haaren,Mit süßem, seligem GesangBeginnt sie aufzufahren.Zum Strande strebt ihr junger Leib,Dort glüht so helle Sonne,Und Erdensohn und MeeresweibSind eine einz'ge Wonne.",l0090223,Die Nixe,"Stona, Marie",2,8,Neue Lieder der besten neueren Dichter für's Volk. Zusammengestellt v. Dr. L. Jacobowski. Berlin 1899.,b'1899',"Jacobowski, Ludwig [alt. Jakobowsky, Ludwig]"
148,"Warte noch ein kleines Weilchen,Liebe Sonne, lieber Wind!Bis die Primeln und die VeilchenAuf der Wiese kommen sind.Wasser fließen, Wolken eilen...Sieh, am Bache erstes Grün!Liebes Herz, wo wirst du weilen,Wenn die ersten Rosen blühn?",l0090193,Warte noch,"Rodenberg, Julius",2,4,Neue Lieder der besten neueren Dichter für's Volk. Zusammengestellt v. Dr. L. Jacobowski. Berlin 1899.,b'1899',"Jacobowski, Ludwig [alt. Jakobowsky, Ludwig]"
149,"Bist du die Seele, die mit mir sich freutWenn mir das Schicksal duftige Blumen streut?Bist du die Seele, welche Schmerzen fühlt,Wenn wilde Qual mein tiefstes Sein durchwühlt?Bist du die Seele, die mich ganz versteht,Die mit mir lebt und ohne mich vergeht?So frag ich oft, — ein steter Zweifel spricht:""Nein, meiner Seele Seele bist du nicht!""",l0090074,Lied,"Fritsche, Paul",1,8,Neue Lieder der besten neueren Dichter für's Volk. Zusammengestellt v. Dr. L. Jacobowski. Berlin 1899.,b'1899',"Jacobowski, Ludwig [alt. Jakobowsky, Ludwig]"
150,"Draußen am PlatzIn der Kirschenblüt'Beim Bronnen hat mich geherzt mein Schatz,Nicht zu singen und sagen.Ach wie herrlich im SonnenscheinRauschte der Quell! — Daß dich Gott behüt'!Trink ihn, selige Kirschenblüt',Samt der Sonne ins Herz hinein,Goldene Früchte wirst du tragen,Wo draußen am PlatzIn der Kirschenblüt'Beim Bronnen mich hat geherzt mein Schatz,Nicht zu singen und sagen.",l0090056,In der Kirschenblüt',"Fischer, J.G. [alt. Fischer, Johann Georg]",2,9,Neue Lieder der besten neueren Dichter für's Volk. Zusammengestellt v. Dr. L. Jacobowski. Berlin 1899.,b'1899',"Jacobowski, Ludwig [alt. Jakobowsky, Ludwig]"
151,"Ich kenne wohl des Weines KraftVon manchem heißen Tag;Drum such' ich schöne NachbarschaftMir gern beim Zechgelag'.Am liebsten hab' ich in der Näh'Ein lieblich Frauengesicht,Wenn ich das nachher doppelt seh',Dann ärgere ich mich nicht.",l0090174,Freudiger Trunk,"Presber, Rudolf",2,4,Neue Lieder der besten neueren Dichter für's Volk. Zusammengestellt v. Dr. L. Jacobowski. Berlin 1899.,b'1899',"Jacobowski, Ludwig [alt. Jakobowsky, Ludwig]"
152,"Im Föhrenwald wie schwüle!Kein Vogel singt im Feld.Das Reh aus grünem SchattenSieht träumend in die Welt.Am Waldrand fährt ein Wäglein,Hat eben Raum für zwei.Der Kutscher, das Pferd und die PeitscheNicken schläfrig alle drei.Ein altes verstaubtes LederIst über den Sitz gespannt,Darunter ducken zwei Leutchen,Geschützt vorm Sonnenbrand.Sie lachen sich an verstohlenUnd fragen dem Schlaf nichts nach.Sie flüstern und kichern und kosen —Ei sage, was hält sie wach?",l0090100,Hochsommer,"Heyse, Paul",4,4,Neue Lieder der besten neueren Dichter für's Volk. Zusammengestellt v. Dr. L. Jacobowski. Berlin 1899.,b'1899',"Jacobowski, Ludwig [alt. Jakobowsky, Ludwig]"
153,"Wenn ein Kranker schlummernd liegt,Mild vom Traumesarm gewiegt,Schweigen alle im Gemache,Daß der Arme nicht erwache.Leis' ihr Hauch und stumm ihr Mund,Kaum berührt ihr Fuß den Grund —Und der Kranke schlummert weiter,Ruhbeseligt, traumesheiter.Innig fleh' ich jetzt zu dir:Halte du es so mit mir,Mit dem tieferschöpften Herzen,Das entschlummert ist voll Schmerzen.Halb verblutet schläft es fort,Weck' es nicht mit deinem Wort;Trage schonendes ErbarmenMit dem Kranken, Müden, Armen.Willst du's wecken, sei's zum Glück,Kannst du dies nicht, tritt zurück!Gieße Gift nicht in die NeigeMeines Lebens! Schweige! Schweige!",l0090163,Stille,"Paoli, Betty",5,4,Neue Lieder der besten neueren Dichter für's Volk. Zusammengestellt v. Dr. L. Jacobowski. Berlin 1899.,b'1899',"Jacobowski, Ludwig [alt. Jakobowsky, Ludwig]"
154,"Steht ein Haselstrauch an unsrem Wiesenhang,Der hat Blätter rot wie Blut,Saß ich dort so manches Mal und lacht und sang —Ach, nun ist mir weh zu Mut.Hängt ein rotes Kleid in meinem Kleiderspind,Und daneben stehn die Schuh,Die den bösen Weg mit mir gewandert sind,Wo mein Herz verlor die Ruh.Liegt ein kleines Bild verborgen tief im Schrein,Seh es nimmer, nimmer an:Denn der's einst mir gab, ach, er ist schuld allein,Daß ich nicht mehr froh sein kann.",l0090118,Volksweise,"Klie, Anna",3,4,Neue Lieder der besten neueren Dichter für's Volk. Zusammengestellt v. Dr. L. Jacobowski. Berlin 1899.,b'1899',"Jacobowski, Ludwig [alt. Jakobowsky, Ludwig]"
155,"Es blüht ein Grab in treuer Hut,Das beste Herz darinnen ruht.Zu oberst blühen Rosen rot —Dein Mund so manchen Kuß mir bot,Und weiter ab die Lilie blüht —Dein Herz hat rein für mich geglüht.Zu Füßen liegt ein grüner Kranz —Ich schwang Dich oft im Maientanz.Die Leute gehen dran vorbei,Mir aber bricht das Herz entzwei.",l0090083,Ihr Grab,"Greif, Martin",5,2,Neue Lieder der besten neueren Dichter für's Volk. Zusammengestellt v. Dr. L. Jacobowski. Berlin 1899.,b'1899',"Jacobowski, Ludwig [alt. Jakobowsky, Ludwig]"
156,"Bei Rädergerassel und Pferdegetrab,Wie saust das so lustig bergauf, bergab!Die Peitsche knallt und der Radschuh schleift,Und den Rossen voran tanzt der Pinsch und keift.Das tauige Feld spielt im Sonnenlicht,Keck schlägt uns der Lärchbaum den Ast ins Gesicht;Der Bauer grüßt hinterm Pfluggespann,Und der Kuckuck hänselt und lockt im Tann.So geht's in den Morgen. Der Wind streicht frisch,Zur Seit' uns sprudelt des Wildbach's Gezisch,Und hemmt gar ein Örtchen den fröhlichen Lauf,Ei, wie reißen die Mädel die Fenster auf!Streckt aber der Herrgott den Arm wo hinaus,Da grüßt schon von weitem der Schwager das Haus,Und tirili, tirili, bläst er so hell,Daß vor Übermut aufjauchzt der trübste Gesell.Das Mädel läuft flink mit der Flasche daher,Der Hausknecht grüßt, gravitätisch und schwer;Die Rosse schnauben und steh'n voll Schaum,Und die Finkenbrut zetert vom Apfelbaum.Wo blieben nur Sorgen und Schrullen zurück?Der Frohsinn kutschiert, und am Bock sitzt das Glück!Hell jauchz' ich hinaus, daß im Echo es gellt:""Sei gegrüßt mir, du herrliche, weite Welt!""",l0090253,Bei Rädergerassel und Pferdegetrab...,"Wallpach, Arthur von",6,4,Neue Lieder der besten neueren Dichter für's Volk. Zusammengestellt v. Dr. L. Jacobowski. Berlin 1899.,b'1899',"Jacobowski, Ludwig [alt. Jakobowsky, Ludwig]"
157,"Und der Nachbarssohn, der Ruprecht,Wie oft der des Tages kam!Denn wir spielten ja im HausflurImmer Braut und Bräutigam.Und der grüne PuppenwagenDer war unser größtes Glück.Unsere Kinder schliefen drinne,Meine Puppen, dreizehn Stück!",l0090112,Kindergeschichte,"Jacobowski, Ludwig",1,8,Neue Lieder der besten neueren Dichter für's Volk. Zusammengestellt v. Dr. L. Jacobowski. Berlin 1899.,b'1899',"Jacobowski, Ludwig [alt. Jakobowsky, Ludwig]"
158,"Du Sonne scheinst mir viel zu hell,Die Nacht, die will ich lieben;Der Sternenglanz und die süße Nacht,Die können kein Herz betrüben.Es sieht sich so schön das Leben an,Wenn Schlaf und Nacht es umschweben,Beinah', als müßt es doch irgendwoGlück und Glückliche geben.",l0090252,Schlaf,"Walloth, Wilhelm",2,4,Neue Lieder der besten neueren Dichter für's Volk. Zusammengestellt v. Dr. L. Jacobowski. Berlin 1899.,b'1899',"Jacobowski, Ludwig [alt. Jakobowsky, Ludwig]"
159,"Nicht, wie jugendliche HerzenFeuer sprühen und sich lieben,Daß die Sorgen und die SchmerzenFlattern und in Luft zerstieben,Nein, im Mißtrau'n alle beide,Das der Zweifel emsig schürte, —Eine Liebe war's im Leide,Welche uns zusammenführte.Und schon mondenlange ziehenWir in Zaudern hin und Bangen, —Dieses Auseinanderfliehen,Dieses Aneinanderhangen!Da sich Mund schon neigt zu Munde,Muß der schöne Traum entschwinden,Bis wir in der nächsten StundeNeu ihn suchen und ihn finden.So in währender ErregungSind wir bald beengt und trüber,Bald in wachsender BewegungGeht das Herz uns schäumend über;Aber diese schwer enthüllteLiebe, früh geprüft von Pein,Wird uns einst der vollerfüllteHochgewinn des Lebens sein!",l0090117,Zaudernde Liebe,"Kitir, Josef",3,8,Neue Lieder der besten neueren Dichter für's Volk. Zusammengestellt v. Dr. L. Jacobowski. Berlin 1899.,b'1899',"Jacobowski, Ludwig [alt. Jakobowsky, Ludwig]"
160,"Am Schlehdorn, am Schlehdorn —Wißt ihr, wo der steht?Da sprach der HirtenknabeSein Morgengebet.Trieb die Schafe dann auf die WeideHin durch den sonnigen Raum;Über die blühende HeideTräumte sein junger Traum.Am Schlehdorn, am Schlehdorn —Wißt ihr, wo der steht?Da sprach eine junge DirneIhr Abendgebet.Und der Wind kam von der Heiden,Und küßte ihres Kleides Saum...Die beiden, die beidenTräumten den ersten Traum.",l0090044,Jugend,"Evers, Franz",2,8,Neue Lieder der besten neueren Dichter für's Volk. Zusammengestellt v. Dr. L. Jacobowski. Berlin 1899.,b'1899',"Jacobowski, Ludwig [alt. Jakobowsky, Ludwig]"
161,"Wie ich 'nein ins Holz bin gange,Hott der Kuckuck laut geschrien,Un do blieb ich meiselstilleUnnern bliehenden Ahurn stiehn.Hoh gelauscht un hoh's gezählt äh,Wie viel Mol er rufen thet,Zähne, fufzen, zwanzig, dreißig,Du mein Gott, des wier ge spet.Hett ich des gewußt, daß dreißig,Dreißig Gohr ich warten sell,Hett de Uhrn ich zugehaltenUn waer ausgerissen schnäll.",l0090041,Der Kuckuck,"Doehler, Gottfried",3,4,Neue Lieder der besten neueren Dichter für's Volk. Zusammengestellt v. Dr. L. Jacobowski. Berlin 1899.,b'1899',"Jacobowski, Ludwig [alt. Jakobowsky, Ludwig]"
162,"Es glänzt die laue Mondnacht,Die alten Wipfel ragen,Das Bündel ist zurecht gemacht,Im Torweg steht der Wagen.Und unterm Torweg standen zwei,Kein dritter stand daneben,Die sprachen noch von Lieb und Treu —Dann geht's hinaus ins Leben.Das letzte Röslein gab sie ihmUnd gab ihm beide HändeUnd küßt ihn sacht — und wie er ging,Da ging ihr Trost zu Ende.Der Hufschlag dröhnt, das Posthorn schallt,Durchs Tor hin rollt der Wagen.Ihr war, als hätt' er all ihr GlückIm Bündel fortgetragen.",l0090221,Im Torweg,"Stieler, Karl",4,4,Neue Lieder der besten neueren Dichter für's Volk. Zusammengestellt v. Dr. L. Jacobowski. Berlin 1899.,b'1899',"Jacobowski, Ludwig [alt. Jakobowsky, Ludwig]"
163,"In brauner FaustDie Sense saustDurchs goldene Ährenfeld —Die Sense klingt,Die Sense singt:Mein ist die ganze Welt!Ein Zittern geht,Ein Seufzen fleht,Schwer schwankt der Halm und fällt —Die Sense klingt,Die Sense singt:Mein ist die ganze Welt!Der Tag verrinnt,Der Abend spinntDie Schatten übers Feld —Aus SternenhöhnKlingt's friedeschön:Mein ist die ganze Welt!",l0090183,Erntetag,"Remer, Paul",3,6,Neue Lieder der besten neueren Dichter für's Volk. Zusammengestellt v. Dr. L. Jacobowski. Berlin 1899.,b'1899',"Jacobowski, Ludwig [alt. Jakobowsky, Ludwig]"
164,"Mondschein will mit sanftem GlühnNun des Waldes Dunkel lichten;Einsam schleicht ein Karren dahinDurch des Hohlweg's düstere Fichten.Müder schleicht am Karr'n das Pferd,Und der Fuhrmann schmiegt sich träumendAn das Mädchen, das er fährt,Weg und Karr'n und Roß versäumend. —",l0090251,Der Fuhrmann,"Walloth, Wilhelm",2,4,Neue Lieder der besten neueren Dichter für's Volk. Zusammengestellt v. Dr. L. Jacobowski. Berlin 1899.,b'1899',"Jacobowski, Ludwig [alt. Jakobowsky, Ludwig]"
165,"Die Feder am Sturmhut in Spiel und Gefahren,Halli.Nie lernt ich im Leben zu fasten, zu sparen,Hallo.Der Dirne lass' ich die Wege nicht frei,Wo Männer raufen, da bin ich dabei,Und wo sie saufen, da sauf ich für drei.Halli und Hallo.Verdammt, es blieb mir ein Mädchen hängen,Halli.Ich kann sie mir nicht aus dem Herzen zwängen,Hallo.Ich glaube, sie war erst sechzehn Jahr,Trug rote Bänder im schwarzen Haar,Und plauderte wie der lustigste Star.Halli und Hallo.Was hatte das Mädel zwei frische Backen,Halli.Krach, konnten die Zähne die Haselnuß knacken,Hallo.Sie hat mir das Zimmer mit Blumen geschmücktDie wir auf heimlichen Wegen gepflückt —Wie hab ich dafür ans Herz sie gedrückt!Halli und Hallo.Ich schenkt ihr ein Kleidchen von gelber Seiden,Halli.Sie sagte, sie möcht' mich unsäglich gern leiden.Hallo.Und als ich die Taschen ihr vollgestecktMit Pralinés, Feigen und feinem Konfekt,Da hat sie von morgens bis abends geschleckt.Halli und Hallo.Wir haben süperb uns die Zeit vertrieben,Halli.Ich wollte, wir wären zusammengeblieben.Hallo.Doch wurde die Sache mir stark ennüyant,Ich sagt' ihr, daß mich die Regierung ernannt,Kamele zu kaufen in Samarkand.Halli und Hallo.Und als ich zum Abschied die Hand gab der Kleinen,Halli.Da fing sie bitterlich an zu weinen.Hallo.Was denk' ich just heut ohn' Unterlaß,Daß ich ihr so rauh gab den Reisepaß...Wein her, zum Henker, und da liegt Trumpf-Aß.Halli und Hallo.",l0090137,Bruder Liederlich,"Liliencron, Detlev von [Liliencron, Detlev Freiherr von; alt. Liliencron, Detlev Frhr. von]",6,8,Neue Lieder der besten neueren Dichter für's Volk. Zusammengestellt v. Dr. L. Jacobowski. Berlin 1899.,b'1899',"Jacobowski, Ludwig [alt. Jakobowsky, Ludwig]"
166,"Ach, mir hilft kein Mut,Ach, mir nützt kein Gut,Ach, mir frommt nicht Ruhm noch Segen!Was mich freuen könnt',Ist mir nicht vergönnt,Des gedenk ich allerwegen.Wenn die Sonn' ohn' EndVon dem Himmel brennt,Welkt das grüne Laub am Zweige,Wenn ich eine seh,Tut das Herz mir weh,Und ich geh vorbei und schweige.",l0090122,Der Verzagte,"Klie, Anna",2,6,Neue Lieder der besten neueren Dichter für's Volk. Zusammengestellt v. Dr. L. Jacobowski. Berlin 1899.,b'1899',"Jacobowski, Ludwig [alt. Jakobowsky, Ludwig]"
167,"Seit uns beide getrennt die Zeit,Leb' ich hin am Tage,Ohne Glück und ohne LeidUnd auch ohne Klage.Aber wenn die Nacht beginntUnd die Sterne schimmern,Hör' ich wie ein krankes KindLeis mein Herz noch wimmern.",l0090172,Geschieden,"Poschinger, Heriberta von",2,4,Neue Lieder der besten neueren Dichter für's Volk. Zusammengestellt v. Dr. L. Jacobowski. Berlin 1899.,b'1899',"Jacobowski, Ludwig [alt. Jakobowsky, Ludwig]"
168,"Aus frisch gebroch'nen AckerfeldernAtmet der Erde würziger Duft,Hoch über Saaten hin und WäldernWölbt sich der kühle Dom der Luft.Am Waldrand äsen fromme Rehe, —Wie ausgeschnitten, umriß-rein,Ruht in der klaren FrühlingsnäheDie alte Stadt im Abendschein.Herzlieb, in dieses Bildes RahmenMal' du mit lieber Hand geschwindZwei Menschenkinder ohne Namen,Die unaussprechlich glücklich sind.",l0090254,Bild,"Wallpach, Arthur von",3,4,Neue Lieder der besten neueren Dichter für's Volk. Zusammengestellt v. Dr. L. Jacobowski. Berlin 1899.,b'1899',"Jacobowski, Ludwig [alt. Jakobowsky, Ludwig]"
169,"Hinaus auf die braune HeideFührt mich der Nächte Traum,Da steh ich, gebeugt vom Leide,Wohl unter dem Föhrenbaum.Aus fernen Büschen leuchtenSeh' ich ein Fensterlein;Die Blicke, die tränenfeuchten,Sie stehlen sich hinein.Beisammen im kleinen ZimmerDa sitzen zwei alte Leut',Warum doch schauen sie immerSo traurig drein wie heut?Die Jahre kommen und gehen: —Sie bleiben tränenstumm.O könnt ich sie lächeln sehen,Mein Herzblut gäb' ich drum.",l0090286,Das Elternhaus in der Heide,"Freudenthal, August",4,4,Neue Lieder der besten neueren Dichter für's Volk. Zusammengestellt v. Dr. L. Jacobowski. Berlin 1899.,b'1899',"Jacobowski, Ludwig [alt. Jakobowsky, Ludwig]"
